book_name,book_category,book_intro,book_score,y
정의 중독,인문,"왜 나는 타인을 용서하지 못하고 힘들어할까?
나와 다른 사람을 이해하고,
나를 괴롭히는 감정적 고통에서 벗어나라
20만 독자가 선택한 아마존 재팬 베스트셀러

당신은 어떨 때 타인을 ‘용서할 수 없다’는 생각이 드는가?

연인이나 배우자가 바람을 피웠다, 상사에게 갑질과 성희롱을 당했다, 믿었던 친구에게 배신을 당했다…. 우리 주변에 이런 일을 겪은 사람은 생각보다 많다. 별 생각 없이 SNS에 올린 사진이 생판 모르는 사람의 심기를 건드려 ‘경솔하다’ ‘잘못했다’ 등의 비난을 받기도 한다. 이렇게 우리는 타인과의 관계에서 상처를 받는다. 하지만 나에게 상처를 준 타인을 용서하지 못하는 마음 때문에 괴로운 것은 결국 나 자신이다. 타인을 용서하지 못해서 괴롭고, 그런 자기 자신을 용서하기가 힘든 상반된 감정에서 고통받는다. 누군가를 미워하고 용서하지 못하는 것은 결국 나 자신을 갉아먹는 괴로운 일이다.

SNS 등 온라인에서 선을 넘은 비난과 욕설들을 어렵지 않게 볼 수 있다. 비난의 대상은 연예인, 일반인, 기업 등등 다양하며, 비난 이유는 명백한 잘못에서부터 단순 실수, 무지에 의한 논란, 근거 없는 오해까지 여러 가지다. 비난의 말들을 살펴보면 직접적인 불이익을 받지도 않았고 당사자와 관계도 없는데, 강한 분노와 미움의 감정을 마구 쏟아낸 말들이 아주 많다. ‘저런 짓은 절대 용서할 수 없어’, ‘잘못을 저지른 사람은 호되게 벌을 받아야 해’, ‘난 옳고 쟤는 틀렸으니까 심한 말을 퍼부어도 괜찮아’…. 이또한 일면식도 없는 상대에게 공격적인 말을 퍼붓고 완전히 짓밟아야 직성이 풀리는, ‘용서할 수 없는’ 감정이 폭주한 상태다.

책 《정의 중독》은 인간이 타인을 용서하지 못하는 감정을 뇌과학의 관점으로 풀어내어, 어떻게 하면 우리가 행복하고 균형 잡힌 삶을 살 수 있을지 살펴본다. 일본의 저명한 뇌과학자이자 이 책의 저자인 나카노 노부코는 벌할 대상을 찾아 헤매고 타인을 절대 용서하려 하지 않는 상태를 정의에 취해 버린 중독 상태, 이른바 ‘정의 중독’이라고 말한다. 저자는 “누구나 정의 중독 상태에 빠질 수 있다”라고 경고한다. 왜냐하면 인간의 뇌는 비난받아 마땅한 대상을 찾아 벌하는 데 쾌감을 느끼도록 만들어져 있기 때문이다. 타인에게 정의의 철퇴를 가하면, 뇌의 쾌락중추가 자극을 받아 쾌락물질인 도파민이 분비된다. 이 쾌락에 한번 빠지면 쉽게 헤어나지 못한다. 정의감에 중독된 뇌는 항상 벌할 대상을 찾아 헤매고, 타인을 절대 용서하려 하지 않기 때문이다.

하지만 정의 중독 행위로 인해 쾌감을 느끼는 동시에, 상대를 미워하고 매도하는 자신을 후회하거나 자기혐오에 빠지기도 한다. 저자는 타인의 실수를 비난하여 스스로를 정당화하고 순간의 쾌락을 얻는다 해도, 매일 타인의 언행에 강한 분노를 느끼는 것은 결코 행복한 삶이라 할 수 없다고 역설한다. 그리고 사람들이 타인을 용서하지 못하는 뇌 구조를 이해한 뒤, 평온하게 살아갈 수 있는 힘을 얻기를 바란다고 말한다.

모든 사람을 이해하는 건 불가능하더라도, 할 수만 있다면 타인에게 필요 이상의 분노와 불만, 미움의 감정을 품지 않고 평온하게 사는 편이 자신을 위해 좋은 것은 분명하다. 책 《정의 중독》은 그러한 삶의 고충을 조금이라도 해소하여 마음 편히 살아가기 위한 비결을 알려 준다.
 ",8.8,0
사람에 대한 예의,인문,"각자도생, 한국사회가 잃어버린 가치를 묻다
MD 한마디
차별과 혐오가 만연한 사회다. 다른 사람의 갑질을 욕하면서 어느새 내가 가해자가 되어 있다. 무엇이 한국사회의 악을 만들어왔는가? 이 책은 대한민국 대표 언론인 권석천의 글 모음으로, 독자들에게 제안한다. 괴물과 싸우면서 스스로 괴물로 변하지 말자고. - 손민규 인문 MD
“나 정도면 괜찮은 사람이라고 생각했다”
저널리스트 권석천의 대담하고 날카로운 시각
극단의 시대, 우리가 놓친 것들을 낯선 눈으로 돌아보다

우리는 재벌과 공직자의 갑질에, 세월호 참사를 “교통사고”라 말하는 자들에게 신경이 곤두선다. 성폭력에 분노해 모여서 외치고, 막말을 참지 못해 언론사에 제보한다. 그리고 말한다. 제발 사람을 사람으로 대하라고, 사람에 대한 예의를 지키라고. 민주주의, 산업화, 공정, 정의, 복지, 기본소득에 이르기까지, ‘사람 살기 좋은 세상’을 위한 변화는 계속되는데 왜 사람의 가치는 점점 떨어지는 걸까. 우린 왜 사람을 종종 잊고 마는 걸까. JTBC 보도총괄 권석천의 『사람에 대한 예의』가 출간되었다. 칼럼이 나오는 날이면 진보ㆍ보수를 막론하고 독자들이 돌려가며 읽는 거의 유일한 글쟁이, ‘중앙일보의 송곳’으로 불리는 그는 책에서 극단적인 대립, 각자도생의 한국 사회를 통과하며 우리가 놓쳐버린 가치들을 되돌아본다. 날카로운 필력과 힘 있고 명징한 사유를 통해 오늘을 생생하게 환기하는 책이 드디어 독자를 만난다.

“한국 사회는 조직에 대한 예의, 국가에 대한 예의는 차리라고 하면서 사람에 대해선 건너뛰기 일쑤였습니다. 정말 중요한 순간에 사람은 고려의 대상에서 빠지곤 했지요. 이제 사람에 대한 예의는 시대를 움직이는 정신입니다.”

유례없는 경제성장과 민주주의라는 두 마리 토끼를 잡았다고 자부하는 한국 사회. 하지만 동시에 우리는 한국의 부끄러운 세계 1위의 목록을 볼 수 있다. OECD 산업재해 사망률 1위(매년 2000명의 노동자가 죽는다), 자살률 1위(2019년 기준 15년 연속 1위), 노인 빈곤율 1위, 저임금 여성 노동자 비율 1위, 어린이?청소년 행복지수 최하위까지. 세상의 문제를 바로잡고 대의를 실현하는 데는 노력하고 있지만, 뭔가를 놓쳤다는 생각이 든다.

태안 화력발전소에서 작업 중 사고로 숨진 비정규직 노동자라든지, ‘주민 갑질’에 시달리다 억울함과 두려움을 호소하는 유서를 남기고 스스로 목숨을 끊은 강북구 아파트 경비원이라든지. 우리는 이렇게 사람의 죽음을 목격할 때에만 무엇이 문제인지 얼핏 깨닫는다. ‘사람에 대한 생각’을 하지 않는다는 것. 우린 일을 할 때도, 뉴스를 볼 때도, 댓글을 달 때도, 아이를 가르칠 때도, 식당에서 밥 먹을 때도 사람을 놓치고 있는 게 아닐까 권석천은 질문한다.



 ",9.2,0
초판본 군주론 Il Principe,인문,"『군주론』이란 어떤 책인가?

‘목적을 위해서라면 수단과 방법을 가리지 않는, 파렴치한 권모술수’로 오해받았던 책. ‘세상에 신의 섭리 구현 따위는 없고 권력쟁탈전의 승패만 있을 뿐’이라는 발언으로 교황청의 분노를 샀던 금서(禁書). 저자에게 ‘마키아벨리 같은machiavellian(권모술수에 능한, 비열한)’이라는 불명예스러운 신조어까지 안긴 문제작. 하지만 아는 사람들은 알음알음으로 다 찾아 읽었고, 지금은 지도자들은 물론이고 ‘내 삶의 주인’인 우리 모두의 필독서가 된 『군주론』! 니콜로 마키아벨리가 심혈을 기울여 쓴 『군주론』이 더스토리를 통해 오리지널 초판본 표지로 소개된다.

한때 금서였던 『군주론』은 오해받기 딱 좋은 말들이 넘쳐난다. ‘인간은 은혜를 모르고, 인내를 모르고, 배은망덕하고, 기회주의적이며, 이익에 밝고, 제멋대로 행동한다. 그러니 지도자는 필요하다면 얼마든지 여우처럼 속이고 사자처럼 공격하고 약속을 어기고 악덕을 행해도 된다.’ 오해하지 않으려면 다음 말을 꼭 덧붙여 읽어야 한다. ‘지도자의 목표가 공동체의 평화와 안정이라면!’ 사실 『군주론』은, 강한 리더의 강한 통치로 평화가 오기를 간절히 염원하는 충직한 책인 것이다.

1~14장(총 14장)은 군주국들에 대해서, 15~26장(총 12장)은 군주에 대해서 설명했고, “이탈리아를 외세로부터 해방시켜줄 위대한 시기, 위대한 군주가 바로 지금, 피렌체의 로렌초!”라고 칭송하며 글을 맺었다. 하지만 안타깝게도 로렌초는 『군주론』을 읽지 않았고, 그 때문인지 이탈리아는 19세기 말까지 통일되지 못하고 내내 다퉜다.
 ",9.6,1
비폭력대화 워크북,인문,"비폭력대화, 바로 실천할 수 있는 평화와 공감의 언어

마셜 로젠버그의 『비폭력대화』 구성에 따라 14주 동안 비폭력대화(NVC)를 일상적으로 연습하고 실천하는 방법을 안내하는 책. 『비폭력대화』 개정판에 맞추어 제11장 ‘갈등 해결과 중재’ 연습을 추가하고 잘 읽히도록 문장을 손봄으로써 실용성과 완성도를 한층 높였다.

비폭력대화(Nonviolent Communication; NVC)는 우리에게 새로운 방법으로 생각하고 말하기를 요구한다. 다시 말해, 우리가 살아가는 방식을 바꿀 것을 요구한다. NVC를 통해 큰 감명을 받았다 하더라도, 우리의 삶은 연습과 실천에 의해서만 바뀔 수 있다. 이 워크북은 우리 삶을 바꾸는 NVC를 어떻게 일상에서 연습하고 실천할 수 있는지 알려 주는 안내서이다. 기본 텍스트인 『비폭력대화』(마셜 B. 로젠버그)의 내용을 한 주에 한 장씩 14주 동안 연습하도록 구성되어 있어, 독자는 앞에서 배운 것을 잊지 않으면서 새로운 내용을 이해할 수 있는 시간도 규칙적으로, 충분히 가질 수 있다.

연습모임을 만들고 운영하는 방법에 대한 자세한 설명, 모임 진행자를 위한 친절한 안내가 함께 NVC를 연습하려는 사람들에게 큰 도움이 된다. 아울러, 워크숍이나 연습모임에 참가할 수 없어 혼자서 연습하려는 개인을 위한 안내를 ‘참고’ 형식으로 꼼꼼히 제시하고 있는 것도 이 책의 빠뜨릴 수 없는 장점이다. 혼자 연습하는 개인은 워크북에서 안내하는 대로 책 복습, 활동, 간단한 과제들을 스스로 해 봄으로써 NVC를 더 깊이 이해하고 일상에서 능숙하게 그것을 사용하는 즐거움을 누리게 될 터이다. 연습모임에서는 모임의 구성과 진행, 다양한 그룹 활동에 관한 아이디어와 더불어, 모임에서 흔히 일어나는 갈등을 다루는 방법들을 배우게 될 것이다. 그리고 교사(강사)는 이 워크북을 바탕으로 자기만의 NVC 강의를 새로 개발하거나, 기존 강의 내용을 더욱 풍부하게 할 수 있을 것이다.",9.6,1
자존감의 여섯 기둥,인문,"자존감 연구의 선구자가 쓴 평생 연구의 결정체!

미국 심리학자 너새니얼 브랜든은 평생 동안 자존감 중심 심리 치료에 힘쓰고, 자존감 향상 프로그램을 널리 알리는 데 힘을 쏟았다. “자존감의 대가” “자존감이라는 개념의 아버지”라고 불렸으며, 자존감의 근원과 작동 원리를 처음으로 명확히 밝힌 학자라는 평가를 받았다. 《자존감의 여섯 기둥》은 브랜든이 스스로 자신의 대표작으로 꼽은 책이다.

《자존감의 여섯 기둥》은 기본적으로 자존감에 관한 네 가지 핵심 질문에 대한 답으로 구성되어 있다. 자존감이란 무엇인가? 자존감은 왜 중요한가? 자존감을 높이려면 어떻게 해야 하는가? 자존감에 영향을 끼치는 요인에는 어떤 것들이 있는가?
 ",9.3,0
소크라테스 스타일,인문,"개소리와 가짜뉴스, 팬데믹과 기후 재앙의 시대에 읽는 소크라테스 사유의 기술, 삶의 방식
이성의 시대의 문을 연 혁명적 인물 소크라테스와 그 계보를 잇는 ‘빼기의 천재들’을 만난다!

소크라테스의 혁명적인 사유와 삶의 방식을 조명하여, 그것의 본질을 ‘빼기’로 규정하고, 그것이 지난 2,400년 동안 인류문명 각 방면에서 일으킨 ‘소크라테스 스타일 이팩트’를 낱낱이 소개한다. 디오게네스의 ‘냉소’에서부터 키르케고르의 ‘실존’까지, 세네카의 ‘절제’에서 소로의 ‘불복종’까지, 위-디오니시우스의 ‘부정’에서 비트겐슈타인의 ‘침묵’까지. 미켈란젤로의 ‘제거’에서 쇤베르크의 ‘무조’까지, 바디우의 ‘빼기’에서 스티브 잡스의 ‘심플’에 이르기까지, 그의 사유와 삶의 방식이 서양문명에 깊숙이 남긴 자국, 즉 ‘소크라테스 스타일 이팩트’를 추적한다. 가짜뉴스와 개소리, 팬데믹과 기후변화와 같은 재앙에 직면한 현대인에게 소크라테스가 보내는 경종이자, 새로운 사유와 삶을 향한 초대장이기도 하다. ‘생각의 시대’-‘이성의 시대’-‘융합의 시대’로 이어지는 서양 사유사를 추적하는 대장정 중 ‘이성의 시대’ 연작 가운데 첫 번째 책.
 ",9.9,1
글쓰기 인문학 10강,인문,"본격적인 글쓰기에 도전하려는 사람들에게 꼭 필요한 실기 위주의 실용 글쓰기 책. 페이스북과 신문 등에서 활발한 글쓰기를 펼치고 있는 양선규 교수가 그동안의 글쓰기 체험을 충분히 녹여서 풍부한 예시문과 함께 핵심적인 글쓰기 요령을 제시한다. 설명, 묘사, 서사, 논증, 글쓰기 병법 등 다섯 가지 글쓰기 기초 영역과 맥락을 살리는 글쓰기. 여운을 남기는 글쓰기, 후회 없는 글쓰기, 자기를 확장하는 글쓰기, 감동을 주는 글쓰기 등 다섯 가지 글쓰기의 응용 영역을 다루고 있다.

40년 동안 소설, 수필, 평론, 논문, 칼럼 등을 써오면서 현장에서 직접 체득한 저자만의 필수 글쓰기 필수모티프와 기술들이 체계적으로 실려 있다. 글쓰기 필수모티프와 기술들을 효과적으로 습득하는데 도움을 주는 완성도 높은 예시문들과 그 예시문들이 이루어지는 전반적인 글쓰기 과정에 대한 선명한 분석과 해설이 알기 쉽게 제시된다. 글쓰기에 처음 입문하는 사람들도 큰 어려움 없이 글쓰기에 대해서 친숙하게 접근할 수 있도록 선과 후가 짜임새 있게 배치되고 있는 책이다.",9.9,1
왜 얼굴에 혹할까,인문,"MD 한마디
우리는 누군가와 마주할 때 가장 먼저 얼굴을 본다. 얼굴을 보면 그 사람이 누구인지 식별할 수 있고, 얼굴에 드러난 표정을 근거로 의사소통을 이어나갈 수 있어서다. 이 책은 최신 뇌과학과 심리학 연구 결과를 바탕으로 얼굴에 담겨진 비밀을 흥미롭게 풀었다. - 손민규 인문 MD
마음을 봐야 하는데 자꾸 얼굴을 보게 된다고요?
“얼굴을 보는 건 지극히 정상입니다”
뇌와 마음을 사로잡는 얼굴에 대한 가장 과학적인 안내서

지문보다 페이스 ID가 흔하고, SNS 프로필 사진 등으로 어쩌면 우리는 예전보다 얼굴을 자주 보고 있다. 하지만 한편으로는 마스크로 얼굴의 반을 가린 팬데믹 시대에 살고 있기도 하다. 타인에게 내 얼굴은 얼마만큼의 영향력을 행사할까? 반대로 나는 타인의 얼굴을 보고 어떤 영향을 받을까?

우리가 누군가를 마주할 때는 얼굴을 가장 먼저 보게 된다. 얼굴부터 보는 이유는 인간은 오래전부터 얼굴만 보고도 의사소통을 할 수 있도록 진화되었고, 그 결과 얼굴을 보고 그 사람이 누군지 알아보는 것을 넘어 얼굴에 담긴 타인의 정보를 순식간에 포착할 수 있기 때문이다. 이 책의 저자는 시지각을 전공한 심리학자로, 얼굴을 심리학과 뇌 과학으로 파헤친다. 《왜 얼굴에 혹할까》는 얼굴에 어떤 정보들이 담겨 있는지, 그 정보들을 우리가 어떻게 받아들이고 해석하는지를 담은 얼굴 안내서다. 얼굴만 봐도 인간의 뇌는 0.1초 만에 인상을 형성해 타인을 파악한다. 우리가 ‘얼굴을 보지 말아야지’ 생각하면서도 무의식적으로 얼굴에 혹하는 이유다.

한 번쯤 얼굴만 보고 타인을 판단한 경험이 있을 것이다. 그렇다고 자책하진 말자. 인간은 얼굴을 보도록 태어났으니. 중요한 것은 누구나 자기도 모르게 얼굴에 혹하게 되어 있으며, 얼굴로 판단하는 정보들이 꽤 많다는 것이다. 이제 내면을 들여다보려고 애쓰지 말고, 이 책을 통해 얼굴부터 잘 읽어보자. 우리는 생각보다 얼굴로 많은 이야기를 나누고 있다는 것을 깨닫게 될 것이다.
 ",9.8,1
해방자 신데렐라,인문,"깊은 사유와 매혹적인 글쓰기의 에세이스트 리베카 솔닛의 첫 픽션이자 그림책이 출간되었다. 신데렐라가 이룬 변신이 단순히 누더기 옷에서 드레스로의 변화, 왕자의 신붓감으로의 신분 상승이 아니라면? ‘신데렐라’에서 세상을 변화시키는 소녀의 변신에 관한 이야기를 발견해내는 새로운 동화다. 솔닛은 ‘해방자’라는 신데렐라의 새로운 얼굴을 찾아냄으로써 가부장적 서사의 대명사라 할 법한 옛이야기에 새로운 의미와 활기를 불어넣는 데 성공한다.

이 책은 ‘동화 다시 쓰기’ 실천의 탁월한 사례로, 젠더·인종·계급·문화적 차별과 소수자를 향한 편견을 담고 있는 많은 전래 동화에 대한 문제의식을 공유한다. 그러나 그렇게 개작된 이야기들이 오래 사랑받지는 못한 이유와 달리, 『해방자 신데렐라』는 ‘정치적 올바름’뿐 아니라 이야기책으로서 읽는 재미와 그림책으로서 보는 즐거움, 문학적 아름다움을 풍부하게 갖추고 있다.

이 책 속의 신데렐라는 자유와 독립(집 떠남)의 의미, 우정과 연대의 가치를 자연스럽게 체화하며, 나아가 모든 사람들이 자유롭게 자기가 될 수 있는 최상의 상태를 실현하도록 도와주는 해방자가 된다. 어떤 거리낌이나 죄책감 없이 마음껏 좋아할 수 있는 신데렐라 이야기가 새로 하나 생겨난 셈이다.
 ",9.7,1
불안한 마음을 잠재우는 법,인문,"내 안의 불안과 마주하고 흔들리지 않는 삶의 중심 잡는 법
“불안하다고 불행한 것은 아니다.”

살아 있는 한, 불안과 걱정 없이 늘 평화로울 순 없지만 너무 많은 사람들이 이 감정들을 가불하면서 살아가고 있다. 사람이 불안감을 느끼는 이유는 많고 다양하다. 어린 시절에 겪은 트라우마로 특정 상황에서 발현되기도 하고, 완벽주의나 비관주의와 같은 타고난 성격 때문에 유독 불안감에 시달리기도 한다. 하지만 직접적 원인이 없더라도 과잉 자극의 시대를 살아가고 있는 한, 누구도 불안에서 자유로울 수 없다. 특히 2020년은 전 세계적인 코로나 팬데믹으로 미래에 대한 불확실성이 더욱 커지며 앞으로 어떻게 살아야 하는가에 대한 스트레스가 더해지고 있다. 나이가 들수록 새로운 모습으로 나타나 ‘나’를 뒤흔드는 불안은 해결할 수 없는 걸까?

15년 넘게 불안과 중독에 대해 연구해온 저자는 우리 인간에게 불안이란, 그림자와 같아서 완전히 없앨 수 있는 존재가 아니고 적당한 불안은 생존과 적응에 필요한 감정이라고 말한다. 그러므로 우리가 고민해야 할 것은 불안한 자신을 자책하고 다그치는 게 아니라 불안과 잘 살아갈 수 있는 자기만의 방법을 찾아가는 것이다.『불안을 잠재우는 법』은 먼저 다양한 형태로 나타나는 불안의 모습, 여러 가지 복합적 불안의 원인들을 보여주고 더 이상 불안에 끌려다니지 않고 새로운 문을 향해 한 걸음 나아갈 에너지원으로 활용할 수 있는 방법과 ‘질병’으로 바라본 불안에 걸맞은 물리적인 처방도 알려주는 책이다.
 ",9.4,0
내 이름의 책 한권,인문,"나는 책을 쓰고, 책은 나를 리부팅한다
‘내 이름의 책 한 권’으로 인생의 새로운 장을 연다
책을 내고 싶은 모든 예비 저자들이 반드시 읽어야 하는 필독서가 나타났다

많은 사람들이 가지고 있는 버킷리스트에 거의 빠지지 않고 들어가는 게 ‘내 이름의 책 한 권’일 것이다. 그러나 자신에게 책이 무엇이며, 책에 무엇을 담아야 하며, 책이 자신을 어떻게 변화시키고 성장시키는지 잘 모른다. 또한 어떤 과정을 거쳐 책을 내야 할지 몰라서 그 희망을 가슴 한 구석에 간직해 둔 이들이 많다. 우리나라 업계 최초로 출판 코디네이터 명함으로 활동 중인 저자는 이런 희망을 현실에서 구현하는 데 도움을 주고자 책을 출간했다. 이 책은 자신의 이름으로 출간된 책 한 권이 가져오는 커다란 변화의 드라마를 소개하고 있다. 더불어 세부적으로 책의 방향을 잡는 기획에서부터 목차를 작성하는 법, 원고를 마련하는 과정, 출판 진행을 이해하는 안목, 출판 계약 시 유념에 두어야 할 사항들까지 빠짐없이 담았다. 또한 자비출판이 아닌 자신의 이야기를 가지고 출판사와 인세 계약을 맺는 저자가 되기 위해 어떤 경쟁력을 가져야 하는지도 제시하고 있다.

이 책의 장점은 수천 년 인류의 역사를 거치며 책이라는 매체가 누적해온 콘텐츠의 위력과 책을 통해 자신이 한 단계 더 성장하는 생생한 스토리, 나아가 출판을 통해 얻게 된 삶의 활력과 저자들의 보람을 보여주는 데에 있다. 막 출판에 관심을 가진 초보 저자에서부터 평소 자신의 원고에 자신이 없는 초보 작가, 내 이야기의 경쟁력을 직접 확인하고 싶은 이야기꾼에 이르기까지 일독을 통해 출판 프로세스와 책이 갖는 가치에 대한 적잖은 통찰력을 얻을 수 있을 것이다. 내 이름의 책 한 권을 꿈꾸는 당신의 미완의 원고가 이 책을 통해 새롭게 태어날 수 있기를 희망한다. 저자는 현재 출판 코디네이터와 저자를 겸업하면서 예비 저자들과 출판의 의미와 가치를 고민하는 출판 아카데미를 준비하고 있다. 이는 책이라는 매체를 통해 인생을 반추하고 싶은 예비 저자들과 함께 귀중한 삶의 한 페이지를 기록하는 동행의 발걸음이다.",10.0,1
교양으로 읽는 삼국지,인문,"“중원을 차지하려는 영웅호걸들의 흥미진진한 이야기”

『삼국지』는 1,800여 년 전, 약 일백여 년에 걸친 중국 후한後漢 말에서 진晉나라로 통일되기까지의 천하의 패권을 차지하려는 영웅호걸들의 처절한 역사 이야기이다. 약 칠백여 명이나 되는 수많은 영웅들과 수많은 사건이 끊임없이 이어지는데도 이야기의 전개가 사실적이고 긴밀하게 연결되어 있어 끝까지 정독해서 읽어 보지 않고는 책을 놓을 수가 없다.
 ",9.4,0
매일 인문학 공부,인문,"생각의 힘이 세상을 지배하는 시대
우리에게 필요한 ‘진짜 공부’

갈피를 잡기 힘들 만큼 혼란스러운 세상이다. 비논리적 세상에서 세상의 논리를 찾아야 하고, 정답이 보이지 않는 곳에서 정답을 발견해야 한다. 자의와 타의가 뒤섞여 단절된 삶을 살면서도 빠르고 예측할 수 없는 변화를 따라잡기 위해서는 멈추지 말고 나아가야 한다. 이런 불완전하고 불확실한 세상에서 제 속도를 내며 살아가려면 어떻게 해야 할까?

100만 독자를 사로잡은 ‘인문학 수업’ 작가 김종원은 그 답을 ‘생각의 깊이’에서 찾았다. 생각이 깊어지고 의식 수준이 높아지면 성장하는 속도가 달라진다. 빌 게이츠는 최고 경영자 자리에 올랐을 때 1년에 두 번 아무도 모르는 곳으로 떠나 홀로 사색하는 시간을 가졌다. 헨리 데이비드 소로는 숲속 오두막에서 철저하게 사색을 즐기며 『월든』을 탄생시켰다. 투자의 귀재 워런 버핏은 1년에 50주를 사색하며 보낸다고 했다.

생각하며 살아야 성장할 수 있고, 삶을 변화시킬 수 있다. 그래서 기존 인문학 공부 책들이 ‘지식 쌓기’에만 몰두한다면 이 책은 우리가 제대로 읽고 사색하기를 권한다. 의식, 변화, 철학, 몰입, 지성, 성장, 일상, 사랑, 자립, 삶의 원동력이 되는 9가지 주제 속에서 ‘생각하는 힘’을 키우게 한다. 책을 읽는 동안 우리는 매일 자신을 중심에 두고 더욱더 성장할 수 있다.",9.8,1
