book_name,book_category,book_intro,book_score,y
법화경 마음공부,인문,"이 책 『법화경 마음공부』은 중국의 대표적인 불경 연구가이자 어려운 불교 지식을 가장 대중적인 언어로 쉽게 해설하는 것으로 유명한 페이융 교수의 신작이다. 페이융 교수는 그동안 『초조하지 않게 사는 법(금강경 편)』, 『평생 걱정 없이 사는 법(반야심경 편)』, 『불안하지 않게 사는 법(육조단경 편)』을 통해 불경에 담긴 부처의 지혜를 전해 왔다. 이번에 새로 소개하는 불경은 『법화경』으로 석가가 말년에 설법한 내용을 정리한 것이다. 그만큼 부처가 세상에 전한 메시지 중 가장 완벽한 지혜의 정수가 담긴 것으로 평가받는다.
 ",9.6,1
나 홀로 읽는 도덕경,인문,"2500년이 지나도록 빛나온 지혜의 5천 자를
오늘 나는 어떻게 읽을 것인가?

20여 년간 수많은 강연과 저술을 통해 도가철학과 인문학적 통찰을 역설해온 시대를 선도하는 철학자 최진석의 신간 『나 홀로 읽는 도덕경』은 노자 철학의 정수 『도덕경』의 새 독서법을 제시한다. 2500년이 넘도록 고전으로 살아 있는 『도덕경』이라는 지혜의 5천 자를, 원문과 번역문만 가지고 해설 없이 홀로 읽기가 그것이다. 이는 최진석이 강조해온, 자기 사유의 진정한 주인으로 서는 태도가 그대로 대입된 『도덕경』 읽기라 할 수 있다.

『나 홀로 읽는 도덕경』은 『도덕경』을 공부한다는 한 독자와 최진석의 만남으로 시작되었다. 그는 이 독자와 나눈 『도덕경』에 대한 수많은 질문과 대답들과 더불어 그간 많은 이들이 『도덕경』에 가졌던 궁금증들, 그가 스스로 중요하다고 여기는 『도덕경』의 핵심들을 모아, 이 내용을 나침반 삼아 누구나 ‘나 홀로 읽기’에 도전해볼 수 있도록 40문40답으로 정리했다. 『나 홀로 읽는 도덕경』의 1부 ‘묻고 답하는 도덕경’은 이 40문40답에 해당되고, 2부 ‘나 홀로 읽는 도덕경’은 어떤 해설도 없이 『도덕경』 원문 전체와 최진석의 번역문만으로 이루어졌다. 특히 40문40답은 입말로 정리되어 최진석과 직접 대화하는 듯한 독서를 가능하게 한다. 또한 『도덕경』을 구성하는 총 81장은 경전 구절이라기보다 여든한 편의 시처럼 읽힐 수 있도록 제목을 달았다.

『나 홀로 읽는 도덕경』은 『도덕경』이라는 지혜의 숲을 누구나 혼자서 더 쉽고 자유롭게 거닐 수 있게 도울 것이다. 목차를 따라 1부에 놓인 40문40답을 먼저 읽고서 2부에 놓인 『도덕경』으로 들어가도 되지만, 용감하게 『도덕경』을 먼저 읽고서 40문40답의 대화의 장으로 나와도 좋다. 경전 읽기를 어려워하던 이들에게는 『도덕경』에 대한 접근을 보다 용이하게 해줄 것이며, 이미 노자 철학에 익숙한 이들에게는 『도덕경』을 보다 창의적이고 도전적으로 읽어볼 기회를 열어줄 것이다. 어떤 길로 어떤 걸음으로 가는 독서이든 독서의 주인은 독자 자신이다. 『나 홀로 읽는 도덕경』은 노자의 『도덕경』이 이런 주체적인 독서를 통해 보다 빛나는 지혜의 고전이 된다는 것을 경험하게 할 것이다.

아무리 높은 평가를 받는 고전이라도 숭배의 대상이 될 필요는 없습니다. 숭배하지 않기 힘들겠지만, 어떻게 해서든 자신을 키우는 연료로만 사용해야 합니다. 고전은 소장하는 것이 아니라 차라리 소비하는 것이 낫습니다. 소장자보다는 소비자가 더 주체적이고 독립적으로 읽을 수 있습니다. 이것을 ‘홀로 읽기’라고 해보죠. 이제 친절한 안내와 도움 없이 홀로 읽는 일에 도전해볼 필요가 있습니다._「들어가는 말」에서

 ",9.8,1
무분별의 지혜,인문,"“나는 언제쯤 나 자신에게 만족할 수 있을까.”

완전과 불완전, 좋고 싫음, 옳고 그름이라는 분별의 프레임을 넘어
‘지금’을 있는 그대로 받아들이는 내면의 힘

우리는 늘 더 나은 자신이 되기 위해 애쓴다. 자기 자신에게 기준을 부과하고 거기에 부합하지 않는 지금의 나를 다그쳐 더 완전한 내가 되고자 한다. 하지만 애쓰며 달려간 미래에는 또 다른 지금이 기다리고 있을 뿐이다. 그렇다면 나는 언제쯤 나 자신에게 만족할 수 있을 것인가. 지금 이 순간에 집중하지 못하고 과거의 근심과 미래의 불안으로 달아나기 일쑤인 마음을 어찌해야 할까. 이러한 고민을 끝내기 위해 이분법이라는 사유의 틀을 넘어설 것을 제안하는 『무분별의 지혜: 삶의 갈림길에서 읽는 신심명 강의』가 판미동에서 출간되었다.

20년간 유불도를 넘나들며 동양 철학을 강의해 온 저자는 우리네 삶이 고통스러운 것은 스스로 만들어 낸 기준 때문이라고 말한다. 존재하지도 않는 허구적인 기준을 자기에게 들이대고 요구하며 거기에 맞추려 애쓰기 때문에 삶이 한없이 힘들어진다는 것이다. 고통의 여정을 끝내려면 이분법적인 사고에 근거한 ‘분별’에서 벗어나야 한다고 그는 강조한다. 완전과 불완전, 좋고 싫음, 옳고 그름이라는 이분법에서 벗어나 자유로운 나로 존재할 수 있는 힘, 그것이 바로 ‘무분별’이다. 이 책은 중국에 불법이 전래된 이래 ‘최고의 문자’로 꼽혀 온 경전 『신심명』을 통해 무분별의 지혜에 이르는 길로 안내한다

 ",9.7,1
책은 도끼다,인문,"인문학으로 광고하는 박웅현이 들려주는
풍요로운 삶을 위한 깊이 있는 책 읽기의 정수!


‘넥타이와 청바지는 평등하다’, ‘나이는 숫자에 불과하다’, ‘사람을 향합니다’, ‘진심이 짓는다’, ‘생각이 에너지다’ 등 인간을 향한 따뜻한 시선이 담긴 가치 지향적 광고를 만들며 ‘인문학으로 광고하는’ 광고인으로서 자신만의 독보적인 스타일을 구축한 박웅현. 그는 말한다. 창의력의 전장인 광고계에서 30여 년간 광고를 만들 수 있었던 바탕에는 인문학이 있었고, 그 중심에는 ‘책’이 있었다고. 책을 통해 얻은 예민해진 촉수가 자신의 생업을 도왔다고. 『책은 도끼다』는 인문학적 깊이가 느껴지면서도 사람들의 마음에 깊은 울림을 남긴 광고를 만들어온 저자가 자신의 창의성과 감성을 일깨웠던, 이제는 고전으로 손꼽히는 책들을 소개하는 인문교양서이다.

『책은 도끼다』에 등장하는 책들의 장르는 그 스펙트럼이 다양하다. 시, 소설, 에세이를 비롯해 과학서, 미술사책, 경전 해설서까지 고루 언급함으로써 문학뿐 아니라 철학, 과학, 예술 분야의 이야기 속으로도 독자들을 쉽고 흥미롭게 안내한다. 무엇보다 저자는 책 읽기를 통해 나날의 삶이 풍요롭고 행복해졌다고 고백한다. 김훈, 최인훈, 이철수, 김화영, 손철주, 오주석, 법정 스님부터 밀란 쿤데라, 레프 톨스토이, 알랭 드 보통, 장 그르니에, 알베르 카뮈, 니코스 카잔차키스에 이르기까지 시대와 지역을 뛰어넘어 저자가 매혹됐던 작가들의 이야기와 그들의 문장을 따라 읽어가다 보면, 무뎌졌던 우리의 감각과 시선이 한층 새롭게 깨어나고 확장됨을 느낄 수 있을 것이다.

“내가 읽은 책들은 나의 도끼였다. 나의 얼어붙은 감성을 깨트리고 잠자던 세포를 깨우는 도끼. 도끼 자국들은 내 머릿속에 선명한 흔적을 남겼다. 어찌 있겠는가? 한 줄 한 줄 읽을 때마다 쩌렁쩌렁 울리던, 그 얼음이 깨지는 소리를.” _(저자의 말 ‘울림의 공유’ 중에서)
 ",9.0,0
아침에는 죽음을 생각하는 것이 좋다,인문,"‘추석이란 무엇인가’ 서울대 김영민 교수의
인생과 허무와 아름다움에 대한 몇 가지 이야기

화제의 칼럼 ‘추석이란 무엇인가’의 김영민 서울대 교수. 본질적이되 지루하지 않은 질문과 명쾌하되 가볍지 않은 대답으로 우리 시대를 독창적으로 읽어나가고 있는 그의 첫 책 『아침에는 죽음을 생각하는 것이 좋다』가 출간됐다. 반문과 비틀기, 날렵한 유머와 자유로운 사유로 일상의 진부함을 타파하며 본질을 향해 다가가는 김영민 글쓰기의 정수를 만날 기회가 드디어 찾아왔다. 책은 지난 10여 년간 김영민 교수가 일상과 사회, 학교와 학생, 영화와 독서 사이에서 근심하고 애정한 것들에 대한 이야기들을 담고 있다. 김영민 교수는 이 책을 가리켜 과거의 사람들을 추억하고 미지의 세계를 궁금해하며 새로운 만남을 잊지 않으려는 노력이라고 이야기한다. 책을 매개로 “내 곁의 사람들과 함께 사는 일에 대해 떠들고”, “우리 사회에 통용되는 불문율을 깨뜨리는, 비판적 인식을 공유하고 싶었다”는 김영민 교수. 그는 독자 역시 이 책을 통과하는 동안만큼은 불안하던 삶이 견고해지기를, 독서가 삶의 작은 기반이나마 되어주기를 바란다고 조용히 말한다.

“그리하여 나는 어려운 시절이 오면, 어느 한적한 곳에 가서 문을 닫아걸고 죽음에 대해 생각하곤 했다. 그렇게 하루를 보내고 나면, 불안하던 삶이 오히려 견고해지는 것을 느꼈다. 지금도 삶의 기반이 되어주는 것은 바로 그 감각이다. 생활에서는 멀어지지만 어쩌면 생에서 가장 견고하고 안정된 시간. 삶으로부터 상처받을 때 그 시간을 생각하고 스스로에게 말을 건넨다. 나는 이미 죽었기 때문에 어떻게든 버티고 살아갈 수 있다고.” _8쪽
 ",8.8,0
글쓰기 생각쓰기,인문,"『글쓰기 생각쓰기』는 뛰어난 저널리스트이자 작가로 예일 대학 등에서 글쓰기를 강의해온 윌리엄 진서가 자신의 생생한 경험에서 나온 조언을 담은 글쓰기 지침서로 1976년 초판이 나온 이후 30년 동안 여덟 번에 걸쳐 개정을 거듭하며 100만 명이 넘는 사람들에게 글쓰기의 기본으로 읽혀져온 책이다.

이 책은 문장론, 문체론, 서사론에 대한 연구와 교육이 활발하게 이루어져온 영미권에서 『아메리칸 헤리티지 사전』, 『로제 유의어 사전』, 그리고 문장론의 고전인 『문체의 요소』(The Elements of Style)와 함께 그 유구한 전통의 가장 빼어난 성과로 꼽히는데, 저자는 여행기, 인터뷰, 회고록, 비즈니스 글쓰기, 비평, 유머 등 크게 논픽션이라는 이름으로 묶을 수 있는 넓은 범위를 아우르며 글쓰기를 이야기하고 있다.

참신한 문체와 목소리를 식별하는 감각의 문제, 글쓰기에 대한 두려움을 극복하고 자신감과 즐거움을 갖는 법, 저자 자신의 글을 예로 한 편의 글을 써나가면서 마주치는 여러 결정들을 함께 살펴보는 과정 등을 통해 글을 쓰는 모든 사람들에게 자신의 자세를 뒤돌아볼 수 있는 계기를 주고 있는 책이다.
 ",8.3,0
정리하는 뇌,인문,"“정보홍수, 선택과잉 시대에 생각과 인생의 좌표를 잡을 수 있는가”
인지심리학과 뇌과학 최신 연구로 밝혀낸 정보, 생각, 삶의 정리정돈기술

한때 우리는 사회가 컴퓨터화되면 반복적이고 단조로운 일은 모두 컴퓨터가 처리하고 인간은 좀 더 고귀한 목적을 위해 일하며 더 많은 여가시간을 확보할 수 있을 것이라 믿었다. 하지만 예상은 빗나갔다. 우리 뇌는 더 정신없이 바빠졌다. 연구결과에 따르면, 2011년 미국인이 하루에 처리하는 정보량은 1981년에 비해 5배나 많고, 그 양은 신문 175부에 이른다. 정보 접근성만큼 정보의 질이 좋아진 것도 아니다. “우리는 정보인 척 머리를 들이미는 온갖 사실과 거짓, 헛소리, 소문 등에 맹공격을 받고 있다.” 해야 할 일도 엄청나게 늘어났다. 30년 전만 해도 비행기나 철도 예약은 여행사에서 다 알아서 해주었고 가게에서는 점원이 물건을 함께 찾아주었지만, 이제 이런 일들은 대부분 우리가 직접 해야 한다. 디지털 시대에 접어들면서 해당 분야 전문가나 회사가 부가서비스로 해주던 일을 우리가 직접 하는 ‘그림자 노동shadow work’이 급격하게 늘었고, 기대했던 여가시간은 오히려 줄었다. 물건도 선택사항도 폭발적으로 늘었다. 슈퍼마켓에서 장볼 때 1976년에는 9천여 종의 상품 사이에서 고민했다면, 이제는 4만여 종의 상품을 두고 고민해야 한다.

우리 뇌는 고도로 발달했지만, 인류 역사의 대부분을 차지하는 선사시대 수렵-채집인의 생활에 맞춰 진화한 탓에 이 시대의 정보, 물건, 의사결정 과잉 상황이 버거울 수밖에 없다. 인지 과부하 증상은 우리의 머릿속도 주변 환경도 산만해지는 결과로 이어진다. 가정과 사무실 곳곳에 잡동사니가 무질서하게 쌓이고, 중요한 물건을 어디에 두었는지 깜박하고, 엉터리 정보에 현혹되고, 중요한 의사결정에서 오류와 실수를 범한다. 정보 시대의 인지 과부하 문제의 규명과 처방을 위해 신경과학자이자 인지심리학자인 대니얼 레비틴 맥길대학 교수가 나섰다.

레비틴 교수는 말콤 글래드웰의 책 《아웃라이어》에서 언급되어 세계적으로 화제를 모은 ‘1만 시간의 법칙’을 과학적으로 규명한 장본인이며, 뉴욕타임스 베스트셀러 1위를 15주간 기록한 《뇌의 왈츠》 등 뇌과학 관련 저서로 유명하다. 그는 인지 과부하 시대에 정보와 생각과 주변환경을 정리하고, 효율적으로 의사결정할 수 있는 관건은 바로 뇌의 작동방식을 이해하고 그에 맞춰 정리하는 습관임을 강조한다. 그리고 뇌 신경과학, 인지심리학, 행동경제학 등 다양한 분야의 최신 연구들을 토대로 머릿속에서 시작해서 가정, 비스니스, 시간, 사회 및 인간관계를 체계적으로 정리할 수 있는 방법을 제시한다. 차 열쇠나 서류 같은 물건부터 온라인 사이트의 아이디나 비밀번호 같은 디지털 정보에 이르기까지 일상의 온갖 것들을 잃어버리지 않게끔 체계적으로 정리하는 법을 비롯해 시간과 인간관계를 더 창의적이고 생산적으로 정리하는 법, 비즈니스 업무와 조직체계를 더 효율적으로 정리정돈하는 법, 더 나은 판단과 선택을 위해 정보와 상황을 체계적으로 정리하는 사고법 등 디지털 시대에 필요한 정리정돈의 A to Z를 다루고 있다.


 ",8.8,0
뇌 과학이 인생에 필요한 순간,인문,"MD 한마디
청중의 눈높이에 맞는 재미난 강연으로 뇌과학을 알려온 김대수 카이스트 교수가 쓴 책. 뇌를 이해하면 인생을 주체적으로 운영할 수 있다. 세계를 정확하게 인식하고, 욕망을 조절하여, 창의적으로 세상을 즐기는 데 뇌과학이 힘을 준다. 구체적인 해법이 책 속에 담겼다. - 손민규 인문 MD
“타고난 나를 바꿀 수는 없지만
어떤 삶을 살지는 선택할 수 있다!”

카이스트 학생들을 사로잡은 최고의 명강의
욕망의 유혹, 한계, 착각과 두려움 너머
원하는 나로 변화할 수 있는 과학적 사고법

3회 연속 카이스트 우수강의상을 받고, tvN 「어쩌다 어른」, 팟캐스트 「과학하고 앉아있네」 등에 출연하며 재미난 강연으로 대중에게 지적 즐거움을 선사한 카이스트 생명과학과 김대수 교수의 첫 단독 저서 『뇌 과학이 인생에 필요한 순간』이 출간되었다. ‘뇌의 한계와 능력을 이해하면 전혀 다른 인생을 경험하고 다른 나를 만날 수 있다’고 말하는 저자는 이번 책을 통해 일상생활에서 부딪히는 의문을 뇌 과학적 지혜로 재치 있게 풀어냈다. 뇌의 욕망과 본능을 무작정 따르는 삶이 아닌 우리 각자가 자신의 뇌를 가르쳐볼 수 있다면 더 넓고 깊은 세상을 만끽할 수 있을 것이라 이야기하며 놀라운 뇌 과학 여행의 세계로 독자들을 안내한다.
 ",9.6,1
어떻게 죽을 것인가,인문,"세계적인 사상가 아툴 가완디, 죽음 앞에 선 인간의 존엄과 의학의 한계를 고백하다

오늘날 선진국에서는 인구 구조의 직사각형화가 빠르게 진행되고 있다. 미국의 경우 현재 50세 인구와 5세 인구가 비슷하며, 30년 후에는 80세 이상 인구와 5세 이하 인구가 맞먹을 전망이다. 한국에서도 급속한 노령화가 진행되고 있는 것은 마찬가지다. 65세 이상 인구가 2030년에는 24.3%, 2060년에는 40.1%까지 증가할 것으로 예상된다.
아툴 가완디가 제기하고 있는 문제의식은 이러한 사회 현실과 맞닿아 있다. 그동안 현대 의학은 생명을 연장하고 질병을 공격적으로 치료하는 데 집중해 왔다. 하지만 정작 길어진 노년의 삶과 노환 및 질병으로 죽음에 이르는 과정에 대해서는 관심을 기울이지 않고 있다는 것이다. 사람은 누구나 마지막 순간까지 존엄하고 인간답게 살다가 죽음을 맞이하고 싶어 한다. 이를 성취해 내기 위해서는 어떻게 해야 할까? 저자는 결국 죽을 수밖에 없다는 현실을 인정하는 데서부터 시작해야 한다고 말한다. 그 한계를 인정할 때 비로소 인간다운 마무리를 준비할 수 있다는 것이다.

 ",9.2,0
그때의 나에게 해주고 싶은 이야기,인문,"『익숙해질 때』, 『무뎌진다는 것』, 『나는 어른이 되어서도 가끔 울었다』로
20만 구독자가 사랑한 입소문 베스트셀러 투에고의 첫 ‘인문 에세이’

“사람으로도 위로가 되지 않는 날,
때로는 책 속의 한 문장, 영화 속의 대사 한 줄이 더 위로가 될 때가 있다.
나도 나의 마음에 꼭 들어맞는 단어를 보고 위로를 얻었다.”

2018년 당시 첫 책 『무뎌진다는 것』는 별다른 홍보 없이도 잔잔한 입소문만으로 베스트셀러에 올랐다. 이후 『익숙해질 때』와 『나는 어른이 되어서도 가끔 울었다』 등으로 독자들의 변함없는 사랑을 받은 투에고가 첫 인문 에세이를 출간했다. 이 책에서 저자는 “시간이 지나고 나면 다시 공허해지는 ‘빈 위로’가 아니라, 나를 찾고 ‘진짜 위안’을 얻고 싶었다”고 말한다. 그런데 그렇게 마음의 기원을 찾아 거슬러 올라가다 보니, 자신의 마음을 정확히 표현하는 것 같은 단어와 문장 그 속에 담긴 이야기에 공감과 위안을 얻었고 거기에서 얻은 글감을 하나의 원고로 엮었다.

이처럼 이 책에 등장하는 90여 개의 단어들은 나의 마음의 기원을 의미한다. 독자들은 사전 형식으로 정리된 목차를 보며 그때그때 마음의 와 닿거나 끌리는 단어와 자신의 상황에 맞는 문장을 선택해 글을 읽으면 된다. 또한, 그 속에는 내 마음을 알아주는 것 같은 공감의 문장들뿐 아니라 인문, 심리, 자기계발, 철학서 등 다양한 분야에서 뽑은 우리 인생에 도움이 될 만한 이야기들이 담겨 있다. 즉, 이 책은 나의 마음의 기원에 관한 ‘사전’인 동시에 우리 삶에 원동력이 되어주는 동기부여 명언들을 모아 놓은 에세이기도 하다.



 ",9.3,0
다크호스,인문,"누구도 예상치 못한 길에서 자신만의 시장을 창출한 이들,
우리는 그들을 다크호스라 부른다

전작 『평균의 종말』을 통해 평균의 허상을 폭로한 바 있는 선두적인 사상가 토드 로즈와 신경과학자 오기 오가스는 그동안 하버드 교육대학원의 다크호스 프로젝트를 통해 혜성처럼 등장해 인상적인 성공을 이뤄낸 사람들인 ‘다크호스들’을 연구해왔다. 『다크호스』는 이 두 사람의 그 혁신적 연구 결과가 담겨 있다. 책에는 성공과 행복 추구를 바라보는 기존의 사고방식을 획기적으로 바꿀 수 있는 방향과 지침이 수록되어 있다.

실제로 다크호스들은 표준 공식을 따르지 않고 자신만의 길을 개척해 행복이 충만한 삶을 누리고 있다. 얼핏 보기에는 일탈 행위로 보이는 다크호스들의 여정을 살펴보면 실질적인 성공 법칙이 숨겨져 있다. 그것도 당신이 어떤 사람이든 이루고 싶은 꿈이 무엇이든 상관없이 누구나 다 어울리는 법칙이다. 다크호스들의 성공 법칙은 ‘개인성을 활용해 충족감을 추구하면서 우수성을 획득’하려는 사고방식에 근거하고 있다. 『다크호스』에서 알려주는 다크호스형 사고방식의 4대 요소를 잘 활용하면 당신만의 고유한 관심사, 능력, 환경에 맞는 선택을 내릴 수 있는 자율권이 주어진다. 지금 당신이 여정의 첫 발을 떼려는 중이든 진정한 천직을 깨닫고 그 길로 들어설 방법을 찾고 있든 간에, 『다크호스』가 열정과 성취감으로 충만한 삶을 인도하는 좋은 길잡이가 되어줄 것이다.

 ",9.3,0
"사람, 장소, 환대",인문,"사람, 장소, 환대라는 세 개념을 중심으로
사회를 다시 정의한다!

‘사회적 성원권’ ‘환대’ 등의 문제를 오랜 기간 연구해온 인류학자 김현경의 첫 저서 『사람, 장소, 환대』가 문학과지성사에서 출간되었다. 우리는 어떻게 이 세상에 들어오고, 사람이 되는가? 우리는 사람이기 때문에 이 세상에 받아들여진 것인가 아니면 이 세상에 받아들여졌기 때문에 사람이 된 것인가? 다시 말해 ‘사람’이라는 것은 지위인가 아니면 조건인가? 조건부의 환대 역시 환대라고 할 수 있을까? 우리에게 주어진 환대가 언제라도 철회될 수 있다면, 우리는 진정한 의미에서 환대되지 않은 게 아닐까? 이 책은 이러한 질문들에 답하며, 사회를 ‘시계’(즉 기능을 가진 구조들의 총체)나 ‘벌집’(재생산적 실천을 하는 주체들에 의해 재생산되는 구조)에 비유하는 구조기능주의에서 벗어나, 사람, 장소, 환대라는 세 개념을 중심으로 사회를 다시 정의하는 것을 목표로 삼는다.

 ",9.2,0
트랜센드,인문,"MD 한마디
에이브러햄 매슬로의 욕구단계이론은 개인을 대상으로 한 가설이다. 현대 주목받는 심리학자 스콧 배리 카우프만은 매슬로 이론에서 빠진 게 공존이라고 지적한다. 그는 이 책에서 다양한 분야의 최신 연구 결과와 매슬로의 미발표 글을 검토하여 새로운 욕구단계이론을 제시했다. - 손민규 인문 MD
“자신 안에 있는 무궁무진한 잠재력을 살려 세상에 중요한 한 존재로서 자리매김하는 것에 관심이 있는 사람이라면 예외 없이 읽어야 하는 소중한 책!” _ 김경일(인지심리학자)

무궁무진한 잠재력을 끌어내는 과학적 접근!
잃어버린 ‘나’를 되찾는 심리학의 위대한 여정!

최상의 잠재력은 어떻게 끌어낼 수 있는가? 최고의 마음은 어떻게 만들어지는가? 현대 심리학의 거장 에이브러햄 매슬로는 널리 알려진 ‘욕구단계이론’으로 이 질문에 답하려 했지만, 그의 이론은 미완으로 남고 만다. 이 책에서 인지심리학자 스콧 배리 카우프만은 최신 연구로 기존 욕구단계이론의 한계를 보완한 새로운 욕구단계이론을 제시한다. 매슬로의 ‘피라미드’가 개개인의 고착화된 욕구를 다루었다면, 카우프만이 새롭게 제시한 ‘돛단배’는 전 인류가 함께 나아가는 ‘공존’의 욕구단계이론이다.

이 책 《트랜센드》는 심리학뿐만 아니라 사회학, 인공두뇌학, 신경과학 등 다양한 분야의 최신 연구와 함께 매슬로의 미발표 에세이, 일기 등 방대한 자료 조사를 토대로 한다. 이를 통해 새로운 욕구단계이론을 담아냈고, 부록에는 ‘성장’을 위한 구체적인 액션플랜을 담아 실용성을 높였다. 저자는 이러한 욕구의 통합을 통해 순간의 행복을 넘어 지속 가능한 자아실현을 추구하는 ‘초월’의 청사진을 제시한다.


 ",9.7,1
