book_name,book_category,book_intro,book_score,y
서양철학사 1,인문,"철학사를 항해하는 데 함께할 최고의 길잡이!
노르웨이의 교양 철학 교재에서 출발해 전 세계 14개 언어로 번역된
시르베크와 길리에의 서양철학사, 한국 최초 번역

이 책은 노르웨이를 대표하는 철학자인 군나르 시르베크와 닐스 길리에가 함께 쓴 서양철학사로, 1972년에 처음 노르웨이에서 출판된 후 7차례 개정판이 나왔고, 독일어, 프랑스어, 영어는 물론 러시아어, 중국어, 아랍어를 포함하여 전 세계 14개 언어로 번역된 명저이다. 인구 500만 명의 노르웨이에서 출판된 철학사 책이 14개 언어로 번역되어 다른 지역으로 널리 퍼져가고 있다는 것은 그만큼 이 책의 내용이 탄탄하다는 말일 것이다. 이 책은 애초에 철학을 전공하지 않은 일반 대학생들을 위한 교양 철학 교재로 집필되었다. 이후 노르웨이에서는 대학생이라면 전공과 상관없이 반드시 치러야 하는 철학 시험인 ‘엑사멘 필로소피쿰(examen philosophicum)’의 대표적인 교재로 자리 잡았고, 점차 스칸디나비아 전역에서 그 시험 준비와는 상관없이 읽히게 되었다. 현재는 스칸디나비아 지역을 넘어 다른 지역으로 뻗어나가, 거의 전 세계에서 읽히고 있다.

이 책은 그동안 나왔던 수많은 철학사 책과는 전혀 다른 시각과 참신한 접근, 그리고 명료한 서술과 혁신적인 구성으로 서양철학사 읽기의 새로운 길을 제시한다. 정통 철학으로 여겨지는 사상들 외에도 우리의 인식에 영향을 끼친 여러 분과학문들의 성과를 적극적으로 기술하고 있고, 첨예한 논점에 대한 논의도 피해 가지 않으며, 궁극적으로는 독자 스스로 자신만의 철학적 관점을 형성해갈 수 있도록 정확한 안내점을 제시한다. 독자들은 소크라테스 이전의 철학부터 20세기 말 현대 철학까지 2500여 년의 지적 탐구가 지금껏 보지 못했던 넓고 깊은 스펙트럼 위에서 흥미진진하게 펼쳐지는 모습을 확인하게 될 것이다.
 ",8.3,0
캐릭터 메이커,인문,"『스토리 메이커』, 『이야기 체조』의 저자 오쓰카 에이지의 캐릭터 작법서. 만화, 애니메이션, 게임에 등장하는 ‘캐릭터’는 작품의 성패를 좌우할 뿐 아니라 상품으로서 소비되고, 2차 창작에 사용되기도 한다. 그만큼 캐릭터의 중요성은 크다. 그렇다면 어떻게 캐릭터를 ‘만들’ 것인가? 이 책은 이야기에는 일정한 법칙이 있다는 ‘이야기론’을 바탕으로, 이야기에서의 역할을 고려하여 캐릭터를 만드는 방법을 알려준다. 각 장의 말미에는 과제를 따라 캐릭터를 만들어볼 수 있는 워크숍을 첨부했다.

저자는 서문에서 ‘캐릭터를 만든다’는 행위에 ‘나를 표현한다’는 문제가 있음을 지적한다. 비슷한 설정이라고 해도 더욱 매력적인 캐릭터가 있는 것은 제작자가 가진 개성이 캐릭터에 반영되기 때문이다. 그러나 나 자신을 그대로 드러내는 것과 캐릭터에 ‘나’를 담는 것은 다른 문제다. 그에 따라 각 장의 말미에 워크숍을 실어 그 방법을 매뉴얼로 익힐 수 있도록 했다.",8.3,0
플라톤전집 Ⅳ,인문,"모든 정치사상의 근본인 플라톤의 『국가』
천병희 선생의 번역으로 만나다

‘정치란 무엇인가’라고 묻는 책들의 원조이자 ‘이상국가’ 문헌의 원조인 플라톤의 『국가』를 천병희 선생이 번역한 것이다. 국가란 무엇인가, 정의란 무엇인가, 정의와 불의 중 어느 쪽이 유익한가, 정의란 강한 자의 이익인가, 올바르게 살아야 하는 이유는 무엇인가, 철인(哲人)으로서의 왕은 어떤 교육을 받아야 하는가, 정치인은 어떻게 선발할 것인가 등등 여러 문제에 대한 철학적 주제들을 제시시한다.

플라톤은 아테네의 영향력 있는 귀족 집안에서 태어나 어려서부터 정치에 뜻을 두었다. 20세에 스승 소크라테스를 만나 깊은 지혜에 눈뜨지만, 정권을 쥔 자들에 의해 소크라테스가 사형을 당하자 플라톤은 정계 진출의 꿈을 접고 철학자의 길을 걸으며 인간의 올바른 삶과 국가 정의를 실현하는 방법 등을 고민하게 된다.

『국가 Politeia』는 그 탐구의 결과물로서 정의로운 국가 건설에 필요한 청사진을 제시하고 있다. ‘정의’가 무엇인지 아는 철학자가 이끄는 철인(哲人)통치의 필요성, 수호자에게 필요한 자질과 교육법 등 정치적 논의나 정치철학에 머무르지 않고 형이상학, 윤리학, 인식론, 교육, 경제, 예술, 종교, 신화 등에 대한 무궁무진한 주제를 제시하여 인류가 두고두고 음미할 철학적 주제들을 풍성하게 차려놓았다.

우리가 알고 있는 이 세상이 동굴에 비친 그림자에 불과하다는 ‘동굴의 비유’와 『반지의 제왕』이 영감을 얻은 ‘귀게스의 반지’ 이야기는 아주 유명하다. 이 책은 주로 ‘정의’의 문제를 다루고 있기에 ‘정의에 관하여’란 부제가 붙여지기도 한다. 플라톤의 이상국가론은 이 세상에 한 번도 실현된 적 없고 앞으로도 실현되기 어렵겠지만, 이상적이고 바람직한 정치체제가 어떤 것인지에 대한 논의를 끊임없이 생산해내는 시원이라 할 수 있다.
 ",9.3,0
플라톤전집 Ⅰ,인문,"소크라테스는 왜 독배를 마셨을까

기원전 399년, 아테네와 아테네의 민주주의가 쇠퇴하고 있음을 상징적으로 보여주는 사건이 발생했다. 장터의 철학자 소크라테스가 사형을 당한 일이다. 소크라테스가 자신에게 사형을 선고한 배심원들에게 남긴 마지막 말은 잘 알려져 있다. “저는 죽으러 가고, 여러분은 살러 갈 것입니다. 그러나 우리 가운데 어느 쪽이 더 나은 운명을 향해 나아가는지는, 신 말고는 아무도 모릅니다.”

죽음 앞에서도 의연하고 죽음을 두려워하지 않는 소크라테스는 철학이 죽음의 연습이라는 주장을 보여주는 본보기인가? 그는 왜 죽음을 두려워하지 않는가? 그는 죽음이 몸의 죽음일 뿐, 영혼까지 죽는 것은 아니라고 본다. 몸은 가변적이고 소멸하는 것이지만, 영혼은 스스로 움직이는 원리를 지닌 것이어서 변화에 휩쓸리거나 사라지지 않는다. 몸의 감옥에 갇혀 있던 영혼은 죽으면 원래 살던 이데아의 세계로 되돌아간다.

소크라테스는 죽음의 법정 앞에서 마지막 질문을 던진다. 일시적이고 사라질 몸을 위한 삶인가? 아니면 변치 않고 참된 아름다움을 지닌 영혼의 삶인가? 우리는 ‘삶이냐 죽음이냐’가 아니라 ‘어떤 삶을 살 것인가’ 앞에 서 있다. 몸의 요구들에 얽매인 ‘그저 살아감’인가, 영혼의 진리를 위한 ‘좋은 삶’(훌륭하고 선한 삶)인가?

그는 감옥에서 탈출하지도 않고, 즐거운 여행을 앞둔 사람처럼 의연할 뿐만 아니라, 마지막 순간까지도 슬픔을 가누지 못하는 제자들과 논쟁하고 담론을 주고받으면서 좋은 삶과 진리를 찾는다. 이러한 과정들이 『소크라테스의 변론』 『크리톤』 『파이돈』에 고스란히 담겨 있다.

소크라테스는 위대한 사상을 품었고, 자신의 사상을 사회에 적용해나가는 실천 과정 또한 이성과 분별력에 기반을 두고 있었다. 그러한 사상과 탐구 정신은 동시대인에게 지대한 영향을 주었고 서양철학의 시발점이 되었지만, 자신의 생각이나 행적을 글로 남기지 않았다. 대신 플라톤이라는 빼어난 제자 덕분에 그는 철학사에 잊히지 않고 살아남았다.

스승 소크라테스가 사형당하는 것을 보고 큰 충격을 받은 플라톤은 정계 진출의 꿈을 접고 50년이 넘는 세월 동안 스승 소크라테스가 등장하여 대화를 주도하는 25편의 대화편과 스승이 변론하는 장면을 기술한 『소크라테스의 변론』을 출판했다.
플라톤의 초기 대화편은 소크라테스의 철학을 충실하게 기록하고 있으며, 후기로 갈수록 스승 소크라테스의 입을 빌려 자신의 철학을 말하고 있다고 알려져 있다.
 ",9.4,0
받아들임,인문,"어떻게 해야 자책과 후회 없이 나를 사랑할 수 있을까? 틱낫한 스님과 혜민 스님이 추천한 ‘나를 사랑하는 법’

“나는 정말 쓸모없는 인간이야!” “나는 정말 사랑받고 있을까?” 일이 실패로 돌아갔거나 외로움이 밀려들 때 우리는 흔히 이런 생각에 빠져든다. 이런 자책과 의심을 붓다는 “두 번째 화살”이라 부르며, 이 화살을 맞지 않는 것이 행복하게 사는 길이라 했다. 임상심리와 명상 두 분야의 전문가인 저자는, 두 번째 화살을 맞지 않는 방법으로 ‘근본적 수용(radical acceptance)’ 훈련을 제시한다. 근본적 수용이란 마음챙김 명상으로 자신의 경험을 명확히 보고, 본 것을 자비로 감싸 안는 것을 일컫는다. 근본적 수용의 자세로 살아간다면, 자기 자신을 부정적으로 판단하거나 고통 속에서 허우적대는 걸 멈추고, ‘지금 이 순간’ 속에서 행복할 수 있다.

이 책은 근본적 수용이 우리 삶에서 어떤 변화를 이끌어낼 수 있는지를 구체적인 상담 사례를 통해 보여준다. 누구든 겪었을 법한 보편적인 사례들이 소개되기 때문에, 독자들은 얘기 속 주인공이 바로 자기 자신임을 알게 될 것이다. 그러므로 이 책을 읽는 동안 독자들은 자기 자신의 상처를 만나고, 그 상처가 치유되는 경험을 하게 된다. 무엇보다 “나는 쓸모없는 존재”라는 인식에서 우리를 벗어나게 해준다는 점에서, 이 책은 자기계발과 경쟁에 지친 우리가 진정한 ‘나’를 찾아 참된 행복을 얻을 수 있도록 이끌어준다.

* <받아들임> 카툰 보러 가기
 ",8.9,0
여성과 광기,인문,"전 세계 3백만 부가 팔린 페미니즘의 고전
최초로 여성의 정신건강에 관해 중요한 질문을 던진 역작

페미니스트이자 정신분석학자 필리스 체슬러의 선구자적인 저서 『여성과 광기』는 1972년 출간 당시 『뉴욕타임스 북 리뷰』 첫 페이지에 실린 최초의 페미니스트 작품(에이드리언 리치의 리뷰)으로 기록되었으며 이후 전 세계적으로 3백만 부 이상 팔렸고, 반세기 가까이 지난 지금까지도 놀라울 정도로 시사적이다. 이 기념비적인 작품은 ‘여성’과 ‘정신건강’에 대한 중요한 질문을 처음으로 다루었고 이후 이 주제에 관한 가장 중요한 단 하나의 작품으로 평가받고 있다.

정신의학계에 혁명을 가져온 이 책에서 필리스 체슬러는 가부장제가 광기를 어떻게 정의하고 만들어왔으며 정신과학이 사회적 통제의 한 형태로 광기를 어떻게 이용해왔는지를 집요하게 분석했다. 신화, 역사, 사회에서의 여성의 역할을 실제 환자의 인터뷰에 녹여내 분석한 저자는 여성에 대한 끔찍한 이중 기준이 존재함을 밝혀냈다. 아울러 2005년 개정증보판에서는 전면적인 수정과 개정을 거쳐 섭식 장애, 항우울제에 대한 사회적 수용, 중독, 성욕, 산후 우울증 등을 포함해 오늘날 여성의 정신건강과 밀접한 관련이 있는 문제를 정면으로 다룬다. 치료와 심리학의 세계는 많이 변했지만, 이 책은 출간 당시에 그랬던 것처럼 오늘날에도 시의적절하고 의미 있게 남아 있다.
 ",10.0,1
상처로 숨 쉬는 법,인문,"“우리가 가진 게 상처밖에 없다면 우리는 그것으로 숨을 쉬어야 해요”
불행하고 부자유한 인생을 관통하는 열여덟 번의 철학 강의

아도르노의 철학 에세이 『미니마 모랄리아』로 바라본
철학자 김진영의 삶과 철학, 그리고 문학 이야기

『아침의 피아노』, 『이별의 푸가』, 『낯선 기억들』에 이은 김진영 컬렉션 네 번째 책

『상처로 숨 쉬는 법』은 죽음 앞에서 바라본 삶의 단상을 기록한 『아침의 피아노』와 이별에 대해 미학적으로 접근했던 『이별의 푸가』, 사회에 대한 통찰과 시선을 담은 『낯선 기억들』에 이은 철학자 김진영 컬렉션의 네 번째 책이다. 인문학 교육 사이트인 ‘아트앤스터디’에서 진행되었던 김진영 선생의 아도르노 강의를 녹취하고 풀어 정리했다.

『상처로 숨 쉬는 법』에서 선생은 아도르노의 철학을 매개로 하여 한국 사회의 여러 모습을 고찰하며 삶과 철학, 그리고 문학 이야기를 통해 평범한 우리의 일상을 사유해낸다. ‘왜 선행이, 부드러움이, 착한 삶이 상처가 되어야 하느냐’는 선생의 물음은 ‘상처는 어떻게 삶의 허파가 될 수 있는가?’라는 질문으로 이어지며, 상처를 봉합하려 애쓰기보다는 허파로 만들어 그 상처를 통해 숨을 쉬어야 한다는 성찰에까지 다다른다.

선생은 1학기와 2학기에 걸친 열여덟 번의 강의를 통해 우리 모두 냉정하고 냉철한 비판적 성찰의 주체가 되어 은폐된 채 이 사회를 지배하고 있는 객관적 권력을 통찰해내자고 말한다. 자기 성찰을 통해서만이 상처 안에 머무는 것이 가능하다고 말이다.

매 강의 끝에서 선생은 강의실 맞은편에 앉아 있는 것처럼 “오늘도 수고하셨습니다”라고 우리를 격려하면서, 우리에게 가장 귀했고, 우리가 반드시 보존해야 했었지만 그만 박탈당하고만 아름다움과 자유, 사랑과 행복의 속살을 들여다보는 일을 그치지 말라고 이야기한다. 강의가 끝날 때까지 진짜 ‘나’를 찾아가는 일의 어려움과 슬픔을 우리 곁에서 함께 견딘다.

『상처로 숨 쉬는 법』은 유례없는 팬데믹 상황을 겪으며 겹겹이 상처 입은 우리에게 상처를 외면하지 않고 직시하는 법, 즉 새로운 사유의 단초를 건네며 불행하고 부자유한 인생을 이겨내는 법을 제시해준다.
 ",10.0,1
혼자 있어도 외롭지 않게,인문,"외향성을 환영하는 사회와 사람들 사이에서
내향적인 사람들이 나 자신을 지키고 살아가는 법!

모든 인간의 삶은 자기 자신에게로 이르는 길이다.
_ 헤르만 헤세, 『데미안』

우리 사회는 외향적인 성격을 선호한다. 사람들과 원활하게 소통하고, 밝고 명랑한 사람이 사회생활을 잘한다고 믿는다. 반면에 내향적인 성격에 대해 ‘소심한, 수줍음이 많은, 예민한, 고립된, 사람들과 어울리지 못하는’ 등의 부정적인 수식어를 붙이며 이 사회에 적응하기에는 부족하고 부적절하다고 쉽게 단정한다.

내향적인 성격을 결핍의 문제로 보거나 병리적으로 바라보는 부정적인 시선이 지배적인 사회 분위기이기에, 내향인으로 살아간다는 것은 적잖이 외롭고 다분히 힘에 겨운 일일 수 있다. 저자 역시 내향적인 사람으로 살아오면서 느낀 고충과 어려움이 많았다. 저자는 적극적으로 자신을 드러내고 낯선 사람들과 스스럼 없이 어울리기를 좋아하는 외향적인 사람들을 선호하는 이 사회에서 내향인으로 살아간다는 것의 아픔과 고통을 이해하고 공감한다. 그동안 자신의 내향성을 외면하거나 무시하느라 상처입고 지친 스스로를 돌보고 치유할 수 있기를 바라는 마음을 이 책 『혼자 있어도 외롭지 않게』에 담아냈다. 또한, 내향적인 사람들뿐만 아니라 외향적인 사람들도 이 책을 통해 자기 성찰과 자기 수용이라는 소중한 시간을 가질 수 있을 것이다.

 ",9.8,1
언다잉,인문,"시인 앤 보이어는 2014년 마흔하나의 나이에 대단히 공격적인 ‘삼중 음성 유방암’을 진단받는다. 『언다잉』은 이 암이 유발하는 고통을 견딘 과정을 기록한 투병기다. 하지만 그의 시선은 자기 자신의 몸에만 머물지 않는다. 자본주의와 가부장제, 인종주의의 비정한 폭력을 예민하게 감지하고 시적 언어로 풀어헤쳐 온 작가인 그는 이 책에서도 세상의 잔혹함을 직시하며 고통의 사회적 근원을 되묻는다.

그렇게 『언다잉』은 물리적인 아픔, 몸과 마음 일부를 상실했다는 쓰라림, 혼자라는 외로움, 미래에 대한 두려움을 토로하는 기록인 한편, 보이어의 증언과 고백은 이윤에 혈안이 된 미국 자본주의와, 천진하고 일상적인 온갖 차별과, 유방암으로 죽은 여자들에 대한 애도와, 고통을 매개로 연결되는 낯선 연대에 대한 소망과 뒤얽힌다.

유방암을 다룬 기념비적인 저작들의 목록에 새로운 목소리를 더하고 있는 이 책은 한 매체로부터 “뛰어난 유방암 회고록들을 스펙트럼으로 분류할 때 수전 손택의 글이 가장 덜 개인적이고 이브 코소프스키 세즈윅의 글이 가장 개인적이라면, 『언다잉』은 스펙트럼 전체를 아우른다”는 평가를 받았으며, “질병과 미국 자본주의의 암 돌봄이 얼마나 잔인한지 보여 주는 품위 있고 잊지 못할 서사”라는 선정의 변과 함께 2020년 퓰리처상 논픽션 부문을 수상했다.
 ",9.3,0
끝내주는 괴물들,인문,"세계에서 가장 유명한 독서가 알베르토 망겔이 추억하는
신화와 전설, 문학 작품 속에서 살아 숨 쉬는 상상의 친구들

“한 애서가가 자신이 잊지 못하는 캐릭터들에게 바치는 말과 그림들”
《뉴욕 타임스 북 리뷰》

호르헤 루이스 보르헤스, 움베르토 에코와 나란히 도서관을 사랑하게 만드는 작가라고 불리는 책의 수호자, 알베르토 망겔의 최신작 『끝내주는 괴물들』(2019)이 현대문학에서 번역 출간되었다. 망겔은 그동안 작가이자 번역가, 편집자, 비평가로서 수십 권의 책을 내고 엮었으며, 그 이름 앞에 ‘언어의 파수꾼’ ‘도서관의 돈 후안’ ‘우리 시대의 몽테뉴’와 같은 수식어가 붙는 서구의 대표적 지성이다. 해럴드 블룸과 조지 스타이너 등 그와 비견되던 문학 비평계의 선배들이 타계한 이후엔 전 세계에서 그 누구보다도 방대하게 책을 읽은, 현존하는 최고의 독서가로 꼽힌다.

총 37편의 짧은 에세이로 구성된 이 책은 동화와 코믹북, 신화, 전설, 고전을 망라하는 텍스트들에서 길어 올린 문학 작품 속 캐릭터들의 이야기와, 이들이 주는 메시지를 토대로 사유한 저자의 풍부한 통찰을 담고 있다. 망겔은 「저자 서문」에서 이 가상의 인물들이 피와 살을 지닌 존재들보다도 더 강한 생명력을 지니고 우리 곁에 살아왔다고 말하면서, 자신이 그들에게서 얼마나 많은 조언과 도움을 받았는지 고백한다. 각 장에는 저자가 이들에 대한 애정을 담아 직접 그린 캐릭터 일러스트가 어우러져 한 권의 책으로서 매력을 더하며, 특별히 한국어판에는 한국 독자들에게 전하는 저자의 메시지와 서명이 함께 실려 있다.

시력을 잃은 말년의 보르헤스에게 책을 읽어준 서점 소년으로도 많은 독서가에게 친숙한 저자, 알베르토 망겔. 이제 그가 노년에 이르러 자신과 함께해준 가상의 친구들을 추억하면서 써 내려간 이 글들은 문학을 재료로 삼아 쓰는 자서전이자, 문학의 가치에 바치는 찬사이며, 인생을 살아가는 데 문학이 우리에게 주는 길라잡이들이 담긴 하나의 지침서라고 할 수 있다.

 ",9.8,1
철학과 종교의 세계사,인문,"세상과 존재에 관한 질문에 답한
인류의 사상 3,000년 흐름을
단 한 권으로 응축한 가장 친절한 교양서

일본 베스트셀러 11만 부 돌파
소설가 미야베 미유키 추천
2020년 일본 비즈니스북 특별상 수상
2021년 아사히 신문 “리더의 책장” 선정

세상은 무엇으로 이루어져 있는지 그리고 사람은 어떻게 살아가야 하는지 궁금할 때마다, 태초부터 인류는 철학과 종교로부터 답을 찾아왔다. 철학과 종교는 매우 다른 영역인 것 같지만, 또 이렇게 보면 서로 닮은 구석이 있는 분야이기도 하다. “청년들의 멘토”라고 불리는 저자 데구치 하루아키는 이 두 영역을 통합하여, 세상과 존재에 대한 의문을 풀고자 했던 철학과 종교의 역사를 누구나 이해할 수 있도록 쉽고 깔끔하게 전달한다.

이 책은 세계와 통째로 이해하고자 했던 위대한 철학자들과 세상 사람들을 구원하고자 했던 종교가들의 이상과 이론을 시대의 흐름에 따라 소개한다. 고대의 탈레스부터 현대의 레비-스트로스까지, 그리고 서양에서부터 동양까지 방대한 사상들 가운데 핵심만을 쉽고 재미있게 응축했다. 무엇보다도, 사상가들의 이름과 철학을 단편적으로 나열하는 대신 그들이 출현하게 된 시대적 배경을 충분히 설명하여 그 흐름을 이해할 수 있도록 했다. 특히, 책의 앞뒤에 수록된 컬러 연표와 책 곳곳에 등장하는 도표들은 역사적인 사건과 사상가를 포함한 주요 인물들의 관계를 깔끔하게 정리하여 중요한 흐름을 잡을 수 있도록 돕는다. 철학자와 종교가들의 초상화와 함께 쉽고 유쾌한 문체로 그들의 사유를 전달하는 이 책은 동서양을 넘나들며 인류의 유구한 사상사를 탐구하는 데에 가장 친절한 길잡이가 되어줄 것이다.
 ",9.6,1
디즈니 철학 수업,인문,"* [인사이드 아웃], [뮬란], [겨울왕국] 등 디즈니 영화를 재미있게 본 사람이라면 반드시 읽어야 할 필독서
* 어른과 아이 모두가 열광하는 디즈니 영화 인기의 비결, 작품 속 숨어 있는 철학적 메시지를 분석
* 디즈니를 사랑하는 서른두 명의 철학자들의 알려주는 디즈니 작품, 캐릭터, 테마파크 속 자유와 정체성, 도덕성, 가족, 우정 등에 관한 보편적인 질문

플라톤, 아리스토텔레스, 공자, 데카르트 등 위대한 사상가들이 남긴 철학을 바탕으로 알아보는 삶의 양분이 되는 디즈니 작품 속 철학 이야기

[백설공주와 일곱 난쟁이]부터 시작해 [인어공주], [라이온 킹], [겨울왕국], 그리고 [소울]까지, TV와 영화 속 디즈니의 신비로운 세계는 수 세대에 걸쳐 어른과 아이 모두를 매료시켜왔다. 사람들은 디즈니가 내놓는 애니메이션과 영화를 보기 위해 극장을 가고, 디즈니 캐릭터가 그려진 다양한 상품들을 구매한다. 대체 어째서 우리는 이토록 디즈니에 열광하는 것일까? 그 이유는 디즈니 작품들이 사람들을 환상과 상상력, 무한한 가능성의 세계로 초대하고, 상상의 나래를 무한히 펼칠 수 있는 그 세계 안에 우리 삶의 양분이 되는 철학적 메시지가 숨어 있기 때문이다.

『디즈니 철학 수업』에서는 디즈니를 사랑하는 서른두 명의 철학자들이 다양한 디즈니 작품, 캐릭터, 테마파크 속 철학적 메시지를 분석하고, 우리 삶을 더 풍요롭게 하는 이야기를 들려준다. 플라톤, 아리스토텔레스, 공자, 데카르트 등 위대한 사상가들이 남긴 철학을 바탕으로 디즈니 작품 속에 녹아들어가 있는 자유와 정체성, 도덕성, 가족, 우정에 관한 보편적인 질문을 탐구해보자.
 ",9.0,0
