book_name,book_category,book_intro,book_score,y
그러나 내겐 당신이 있습니다,에세이,"“당신의 글이 쓰러지는 나를 일으킵니다”
장영희 10주기 기념 도서 『그러나 내겐 당신이 있습니다』 출간

자신이 한없이 초라하게 느껴지는 날,
장영희가 남긴 문장들이 지친 당신의 등을 토닥입니다

2009년 봄, 장영희 교수가 이 세상을 떠나고 맞이하는 열 번째 봄이 왔다. 하지만 그 영혼의 불꽃은 그가 남긴 글 속에 살아남아 계속해서 독자들에게 위로와 용기를 주고 있다. 그의 10주기 기념 도서 『그러나 내겐 당신이 있습니다』는 장영희 교수가 남긴 글들 중 독자들에게 큰 사랑을 받았던 유려하고 감동적인 문장만을 가려 뽑아 한 권의 책으로 묶은 것이다.

1장 ‘아프게 짝사랑하라’에는 상처받을까 봐 두려워 사랑하지 못하는 이들을 위한 사랑에 대한 잠언들이 담겨 있고, 2장 ‘How to Love, How to Live’에는 청춘들에게 건네는 문학과 인생에 대한 조언들을 담았다. 3장 ‘네가 누리는 축복을 세어 보라’는 하루하루 삶 속에 보석처럼 숨어 있는 행복을 발견할 수 있는 지혜를 전하며, 4장 ‘살아온 기적이 살아갈 기적이 된다’에는 “신은 다시 일어서는 법을 가르치기 위해 넘어뜨린다”고 말하는 장영희의 주옥같은 희망 메시지들이 담겨 있다.

당당하면서도 따뜻하고, 위트가 넘치는 장영희의 문장들은 더 느리게, 그러나 더 깊이 세상을 볼 수 있는 마음의 눈을 선사한다. 더불어 이 책을 덮고 나면 자신에게 유독 더 버겁게 느껴졌던 쓰라렸던 삶의 무게들이 조금은 가볍게 다가오고, 내면에 숨어 있던 희망이 깨어나는 것이 느껴질 것이다. 그것이 바로 장영희 교수가 치열한 삶 속에서 한 땀 한 땀 엮어낸 문장들이 가지는 힘이다.
 ",9.3,0
영혼을 위한 닭고기 수프 2,에세이,"삶에 잔잔한 위로를 전하는, 평범한 사람들의 고전

전 세계 5억 독자가 읽은 ‘닭고기 수프’ 시리즈의 대표작, 『영혼을 위한 닭고기 수프』가 국내 출간 20주년을 맞이해 새 옷을 입었다. 1993년 미국에서 처음 출간되자마자 그 즉시 베스트셀러에 오른 이 책은 그 후 190주 연속 「뉴욕타임스」 베스트셀러를 기록했으며, 지금까지 전 세계 43개 언어로 출간되었다. 한국에는 1994년(1997년 개정판 출간) 처음 소개되어 지금까지 1백 만 넘는 한국 독자에게 읽혔다. 이처럼 명실상부한 ‘고전 에세이’로 자리 잡은 이 책은 ‘친구 집, 이모네, 우리 집 책꽂이에 꼭 한 권씩은 있었다’, ‘영어 공부하며 수없이 읽었다’, ‘도서관에서 돌려 읽었다’, ‘십 년 만에 꺼내 읽었는데 여전히 좋더라’와 같은 독자 평을 받으며 20년 동안 변치 않고 사랑받아 왔다.
 ",9.6,1
어쩌다 간호사,에세이,"간호사 커뮤니티에서 격한 공감을 불러일으키며
화제가 되었던 『어쩌다 간호사』 단행본 출간!

드라마나 영화 속 꾸며진 모습이 아닌 리얼한 간호사의 일상을 그린 현직 간호사 웹툰이 간호사 커뮤니티에서 화제 된 바 있다. 시도 때도 없이 콜 벨을 눌러 분노케 만드는 할아버지 환자부터 잘해도 못해도 타박하는 선임 간호사, 초과 근무가 잦은 근무 환경 때문에 하루에도 몇 번씩 그만둘까 말까 고민하는 간호사의 시선이 만화에 실감나게 담겼다. 오늘 하루도 사람을 살리는 일에 힘쓰는 간호사들을 눈물짓게 하는 환자들의 이야기와 병원 곳곳에 숨겨진 위로들도 놓치지 않았다. 이렇듯 생생한 간호사의 이야기를 만화 뿐만 아니라 각 에피소드에 대한 작가의 단상과 Q&A로 구성해 새롭게 엮었다.
 ",8.9,0
온 마음을 다해 디저트,에세이,"MD 한마디
디저트 하나가 주는 행복을 아는 사람이라면 좋아할 수 밖에 없는 이야기다. 달달한 행복을 주는 맛부터, 위로를 주는 맛, 어른이 되어 더 생각나는 추억의 맛까지. 별것 아닌 것 같은 이야기에 어느새 끄덕끄덕 공감하며 읽게 된다. - 에세이 MD 김태희
한 입 베어 문 달콤한 그 맛!
만화가 김보통의
추억으로 빚은 디저트 이야기

만화가이자 수필가인 김보통의 신작 『온 마음을 다해 디저트』가 출간됐다. 김보통 작가는 이번 책을 통해 그간 먹어온 디저트와 디저트에 담긴 에피소드를 담백하고 위트 있게 풀어낸다. 그동안 여러 책에서 보여 왔던 작가의 태도 ―이를 테면 그저 살아가는 한 살아갈 뿐이라는 무던한 듯하지만 실은 낙관적인 태도―는 디저트를 먹으며 배워온 삶의 방식이라 해도 지나친 말이 아니다. 디저트로 세상을 배웠다는 작가답게 세상과 사회를 향한 따뜻하지만 예리한 시선 역시 놓치지 않는다.

마음껏 디저트를 먹는 삶을 살고 싶었다는 작가의 고백처럼 책에는 작가가 어린 시절 맛본 디저트부터 여행지에서 먹은 디저트 그리고 성인으로 성장하며 먹어온 디저트까지 총 40가지의 디저트가 등장한다. 어린 시절 향수를 불러일으키는 추억의 디저트를 비롯해 디저트가 주는 따뜻하고 행복한 순간이 책 곳곳에 스며 있다. 무엇보다 슬플 때도, 울컥할 때도 그 곁엔 디저트가 있었다. 대단할 것 없지만, 한 입 베어 문 순간 위로가 되는 달콤한 맛. 디저트가 주는 위로는 언제나 예상을 뛰어넘는 기쁨마저 가져오니, 바로 김보통 작가가 전하고자 하는 바다.
 ",9.6,1
지친 줄도 모르고 지쳐 가고 있다면,에세이,"마음 기댈 곳 없는 이들에게 부치는 편지
희미해져 가는 일상이 빛을 되찾을 수 있도록-
지친 오늘을 살아가는 당신에게 건네는 김준의 위로.

""특별한 하루를 만들기보다는 매일의 평범한 일상을 잘 살아 내자는 마음.""

섬세하면서도 광활한 문장의 세계로 독자를 초대해 위로를 건네는 작가 김준, 그의 다섯 번째 에세이 『지친 줄도 모르고 지쳐 가고 있다면』이 출간되었다. 그는 독자의 지친 마음을 다독이고 무력해진 일상을 되돌아볼 수 있는 여유를 전하려 한다. 우리는 늘 조금 더 나은 내가 되길 바라고, 때로는 더 특별한 내가 되길 바란다. 하지만 시간은 의지와 상관없이 흐르기에 해가 떠오르면 미처 완벽해지지 못한 우리는 자주 넘어진다. 전과 같은 실수를 하고, 전과 같은 절망을 겪고, 특별해지고자 했던 시도는 부끄러운 경험으로 남기도 한다. 쉼 없이 하루를 맞이해야 하는 삶 속에서 우리는 스스로가 지친 줄 모르고 지쳐 간다. 내 안의 에너지가 고갈되는 줄도 모르고 계속 앞으로 나아가려고만 하고 그러다 결국 쓰러지거나 다치는 것이다.

김준 작가는 이러한 마음을 알고 있다. 그렇기에 모든 것이 소진되기 전에 평범한 하루하루를, 또 나 자신을 들여다보고 사소한 것에도 긍정하고 스스로를 달래어야 한다고 말한다. 특별하지 않아도 괜찮다고. 어제와 같은 오늘일 뿐이라고 해도, 우리가 집중해야 할 시간은 지금 흐르고 있으며, 당신을 일군 것은 대단한 사건이 아니라 바로 그 평범한 매일 매일이라고.

""당신의 모든 순간이 오직 살아 있기 때문에 가능하다는 것을 기억했으면."" 반복되는 일상 속에서 소중함을 찾고, 하루하루 더욱 나다워질 수 있도록 이끄는 김준의 에세이, 『지친 줄도 모르고 지쳐 가고 있다면』. 책 속의 소중한 메시지들은 당신을 편안하고 부드럽게 만들어 줄 것이다. 느리게 흐르는 강물이 바다로 향하듯 그의 언어를 간직한 채 내일과 모레를 맞이한다면, 당신은 분명 더욱 거대하고 견고한 스스로에 닿을 수 있을 것이다.
 ",9.6,1
멈추지만 않는다면,에세이,"“지금이 쌓여 미래가 된다!”
‘커다란’ 행복한 미래를 만드는 ‘작은’ 배움과 실천의 힘!

‘너무 힘들어, 나는 못 하겠어, 어차피 안 될 거야….’이렇게 부정적인 생각 속에서 하루하루를 보내는 이들에게 보내는 격려와 희망의 메시지! 대단한 ‘자격’을 가진 사람이 꿈을 이루는 것이 아니라, 꿈을 위해 어떤 상황에서도 걸음을 내딛는 사람이 결국은 꿈을 이룬다는 것을 책 『멈추지만 않는다면』은 보여주고 있다. 저자는 꿈을 이루겠다고 마음먹은 순간부터 평범한 일상을 특별한 기회로 만들기 위해 노력하고, 상처와 좌절마저도 성장의 발판으로 삼는다. 누구에게나 팍팍하기만 한 요즘, 이 책이 많은 이들에게 삶을 긍정적으로 이끄는 데 꼭 필요한 나침반이 되어 주기를 기대해 본다.",10.0,1
우리 세계의 모든 말,에세이,"카카오 브런치, 제8회 브런치북 출판 프로젝트 대상작

91년생 동갑내기 여성 작가 둘이
책에 대해 말하며 주고받은 모든 이야기들

계속 쓰기를 선택한 김이슬, 하현 작가의 ‘독서 교환 편지’를 묶은 에세이. 제8회 브런치북 출판 프로젝트 대상작인 『우리 세계의 모든 말』에서 두 작가는 책에 대해 말하며 모든 이야기를 주고받는다. 깊은 우정을 나누면서도 못다 전한 진심에 대해, 여러 모양의 결핍에 대해, 여자로 사는 일의 지긋지긋함에 대해, 지나온 시간들과 함께할 미래에 대해. 좋아하는 책의 좋아하는 문장을 곱씹으며 어떤 마음으로 살아가고 있는지 이야기한다. 서른 통의 그 편지들은 아주 많은 우리의 세계와도 닮아 있어서 글을 읽으며 우리는 각자의 이야기를 떠올리게 된다. 누군가에게 빼곡한 글자로 편지를 써 나의 기쁨과 슬픔을 털어놓고 싶어지기도 할 것이다. 젊은 작가들이 지금 읽는 책과 독서 행위에서 이어지는 내밀한 사유들을 들여다보며 한 세계를 확장하는 일의 다정함을 감각해 보기를 바란다.
 ",10.0,1
바라만 봐도 좋은 너를,에세이,"“날 바라봐 주고 있는 너를, 그냥 바라만 봐도 좋아.”
소중한 연인에게 선물하고 싶은 아름다운 기억!
SNS 7만 팔로워를 사로잡은 작가 서홍의 첫 일러스트 에세이집!

만개한 벚꽃 앞에서 사랑하는 사람의 눈을 바라본 적이 있는가? 한여름 더위에도 꼭 맞잡은 손을 놓지 않고 걸음을 옮겨 본 경험은? 붉게 물든 낙엽 아래에서 쌀쌀해지는 날씨에 서로의 옷가지를 여며 주고, 따듯한 공간에서 함께 눈 오는 풍경을 바라본 적도 있는가? 예쁘고 사랑스런 그림으로 수많은 팔로워에게 사랑받는 작가, 서홍의 첫 일러스트 에세이집 『바라만 봐도 좋은 너를』에는 모든 연인이 한 번쯤 “너무나 우리 이야기 같아!”라고 외치며 절로 행복해질 수 있는 순간들이 오롯 담겨 있다. 사랑하는 연인이 서로를 바라보는 달달한 눈빛과 그들이 함께 한 빛나는 나날들, 그리고 추억의 풍경이 되어 준 사계절의 아름다움까지, “이 남자 웃는 모습 너랑 너무 닮았어.” 연인과 꼭 닮은 표정을 보며 공감하고, “옛날 생각난다.” 추억을 떠올리며, 다시 한번 사랑에 빠질 수 있을 것이다. 더불어, 자신을 바라보는 연인의 눈에 얼마나 사랑이 가득한지도 다시 한번 깨달을 수 있다. 곁에 있는 사랑을 더욱 소중히 여길 수 있다. 아름다운 일러스트를 통해 우리의 사랑을 되감아 보는 시간을 가지면 어떨까. 우리 둘이서만 예쁘자. 우리 둘이서만 행복하자. 우리 둘이서만 사랑하자. 모든 이들의 사랑이 더욱 귀해지길, 모든 이들의 사랑이 더욱 견고해지길. 당신에게 찾아온 기적과 같은 사랑을 가장 아름답게 표현한 사랑 일러스트 에세이집, 이렇게 사랑스러운 당신을. 이렇게 어여쁜 당신을, 바라만 봐도 좋은 너를.
 ",9.8,1
비에도 지지 않고,에세이,"어른들을 위한 동화, 그림 에세이 『비에도 지지 않고』

세계적인 거장 동화 작가 미야자와 겐지의 글과 유럽이 먼저 알아본 떠오르는 신예 일러스트레이터 곽수진의 그림이 시공간을 초월해 만나다! 곽수진의 따뜻하면서도 희망찬 그림으로 바라본 미야자와 겐지의 묵직한 울림이 담긴 시 [비에도 지지 않고], 얼어붙은 이 시대와 지친 우리의 마음에 용기와 위로를 전하다.
 ",9.6,1
"아무튼, 하루키",에세이,"어린 시절 하루키의 문장에 이끌려 번역가가 된 저자가
서늘한 오이 같은 일상에서 건져 올린 하루키적 모먼트
“하루키를 좋아한다고 말하면 나도 그런 사람이 된 것 같았어.”

아무튼 시리즈의 스물여섯 번째 주인공은 일본 작가 무라카미 하루키다. ‘하루키스트’라는 말이 생겨날 만큼 전 세계적으로 많은 팬을 가진 하루키는 아무튼 시리즈에 처음 등장한 ‘사람’이기도 하다. 사노 요코의 『사는 게 뭐라고』, 고레에다 히로카즈의 『영화를 찍으며 생각한 것』 등을 번역한 이지수의 첫 에세이집으로, ‘하루키’라는 입구로 들어가지만 결국 ‘나’라는 출구로 빠져나오는 다정하고 사려 깊은 에세이 열네 편이 실려 있다.

중학생 시절 『바람의 노래를 들어라』로 하루키 월드에 처음 발을 들인 저자는 어느덧 삼십대 중반의 일본어 번역가가 되었지만, “소화시키지도 못한 채 통째로 외워버려서 마음에 엉겨 붙은” 하루키의 문장들은 언제 어디서든 그를 청춘의 한복판으로 훌쩍 데려다 놓는다. 하루키와 함께 젊은 날의 긴 터널을 지났거나 아직 지나고 있는 독자라면, 이 책은 일상에 치여 잊고 지내던 과거의 어느 눈부신 순간들을 떠오르게 할 것이다.
 ",8.6,0
대나무밭에서 자란 소나무,에세이,"삶의 여정을 통해 얻은 통찰·혜안·사랑의 울림

노인 한 분의 삶은 도서관 하나와 맞먹는다는 말이 있다. 한 사람이 삶을 통틀어 얻게 되는 지식, 통찰, 혜안이 그만큼 크고 값지다는 뜻이다. 올해 희수喜壽를 기념하여 펴낸 송평종 님의 에세이집도 그런 인생살이의 보화로 가득하다. 어린 시절 국어 선생님의 칭찬에 힘입어 쉼 없이 기록해온 진솔한 자기 고백적인 글들이 끝내 값진 보화 밭을 이루었다.
이 보화 밭에는 자신과 타인의 크고 작은 미성숙한 행동을 통해 얻은 깊은 자기 성찰, 한국전쟁 이후 격동의 세월을 거치며 변천해온 시대상, 자연과 세상을 향한 따스한 시선, 절정에 이른 과학 문명 속에서도 불변하는 진리에 대한 수호, 미래 세대의 복리를 기원하는 애틋한 마음, 바벨탑을 세운 세대 못지않게 교만 가득한 세상에서 영원한 삶에 대한 희구와 창조주에 대한 외경과 감사의 알록달록한 소담한 열매들로 풍성하다. 가난 속에도 희망 사랑 넉넉함이 존재하던 과거 세대와 풍요 속에도 절망 결핍 불행을 외치는 현재 세대, 즉, 할아버지와 손자녀들 간에 이해 공감 소통의 다리를 이어줄 만한 책이다. 유성이 흐르는 여름밤에, 눈 쌓인 긴 겨울밤에 한 장 한 장 책장을 넘길 때면 할아버지의 지혜와 인간미 깃든 이야기들이 새록새록 귓가에 울려올 것이며, 그대는 선하고 아름다운 꿈을 꾸게 될 것이다.
_번역작가 라이채
 ",9.2,0
저질러야 시작되니까,에세이,"‘아, 나는 다른 일은 못 하겠구나.
내 가슴을 뛰게 하는 일은 축구밖에 없겠구나.’

인천유나이티드 프런트, 토트넘홋스퍼
한국인 스태프를 거쳐, 다시 K리그로…
좋아하는 일을 위해 달리는 청춘의 뜨거운 분투기

전주에 사는 중학교 1학년 여학생 마음속에 작은 불씨를 심은 것은 2002년 한일 월드컵이었다. ‘문과에 축구 좋아하는 걔’는 대학생이 되고서는 매년 전국여자대학 축구대회에 출전했다. 이전까지 축구를 볼 줄만 알았지, 실제 축구를 하는 건 상상도 못 한 일이었다. 대회 유일의 비 체대 팀으로서 무모한 도전이었지만, 직접 하는 축구는 너무 재미있고 짜릿했다. ‘K리그와 관련된 일이라면 무슨 일이라도 할 수 있을 것 같아.’ 취준생이 된 사커 키드는 우여곡절 끝에 인천유나이티드에 합격, 꿈에 그리던 축구 산업에서 일을 시작한다. 1년을 축구 달력으로 사는 구단 직원의 삶은 바빴지만 즐거웠고, 힘들었지만 짜릿했다.

열심으로 가득 채운 5년 1개월이었지만 뭔가 정체되어 있다는 느낌이 들었을 때, 사커 키드는 마음먹었다. 저질러보기로. 안정된 삶을 뒤로 하고 영국으로 떠난 그는 손흥민 선수가 최고의 활약을 펼칠 때, 토트넘홋스퍼 리테일 스토어의 유일한 한국인 직원으로 근무하며 누구보다 열심히, 그리고 많이 손흥민 선수의 유니폼을 팔았다. 책 『저질러야 시작되니까』는 축구를 사랑한 한 청춘이 가슴 뛰는 일을 향해 도전하고 분투하는 여정을 솔직발랄하게 담아낸 양송희 작가의 첫 에세이다. 또한 그 어느 때보다 오롯이 자기 자신에게 집중하여, 결국 ‘자신을 사랑하는 법’을 배우게 된 한 인간의 성장기이기도 하다.

한국에서의 안정을 내려놓고 타국에서 모험같은 삶을 선택했던 그 당시, 나의 카카오톡 상태 메시지는 ‘저질러야 시작된다’였다. 이는 영국에 있는 내내 단 한 번도 바꾸지 않았다. 무엇이든 시작을 하려면 일단 눈 딱 감고 저지르고 봐야 한다는 이야기였다. 나이 서른에 멀쩡한 직장을 박차고 나왔던 나의 용기는 대단한 믿는 구석이 있어서가 아니었다. 단순히 나의 꿈을 위해 저질렀고, 그것으로 인해 꿈이 시작됐다. 또 그 시작이 많은 것을 바꿔놨다. - 「프롤로그」 중에서
 ",9.3,0
좋은 건 같이 봐요,에세이,"오늘도 하루를 살아 낸 당신에게 선물하고 싶은 따뜻한 위로.

일상의 행복을 놓치며 살고 있는 우리에게 평범하지만 반짝거리는, 사소하지만 소중한 삶의 순간들을 사진과 글로 일깨워 주는 작가 엄지사진관. 누군가 내 삶을 사진과 글로 기록해 한 권의 책으로 엮어 준다면 이런 기분이 아닐까? 아끼는 사람에게 가장 좋은 것을 주고 싶은 마음을 담아 그동안 본 가장 좋은 것들을 당신에게 건넨다. 마치 한 장의 사진처럼 빛나는 삶의 순간들을 고이 모아 선물하듯이.
 ",10.0,1
당신의 질문에 전생은 이렇게 대답합니다,에세이,"나는 누구일까? 무엇을 위해 태어났을까? 왜 이렇게 살고 있을까?
전생 읽는 힐러 박진여의 진정한 나를 찾아가는 전생 리딩 이야기
“전생을 알면 삶의 의미와 방향이 보입니다”

단 1분 만에 상대방의 전생 정보를 읽어들이는 전생 리딩 상담가 박진여. 지난 20년간 CEO부터 정치가, 학자, 의사, 성직자 등 2만 명이 넘는 내담자들의 전생을 읽고 상담하며 써내려간 진정한 삶을 위한 문답들. 지금의 불행과 괴로움의 원인은 무엇인가? 나는 누구이고 무엇을 위해 살아야 하는가? 풀리지 않는 인간관계, 원인 모를 고통과 질병, 용서할 수도 이해할 수도 없는 미움과 갈등에 대한 원인과 해법. 좋은 일이든 나쁜 일이든 현재 우리가 경험하는 일상의 모든 문제들은 전생과 연결되어 있다. 현생의 슬픔ㆍ고통ㆍ기쁨에 담겨 있는 참된 메시지를 깨닫고, 인생을 지혜롭게 풀어나가도록 돕는 새로운 통찰을 만난다.
 ",9.5,0
이러지도 저러지도 못하는 당신에게,에세이,"“이 선택이 옳은 걸까? 저 선택이 옳은 걸까?”

우리는 시작과 끝, 현실과 이상, 버팀과 그만둠 사이에서 갈등한다. 어떤 선택이 더 나은 결과를 가져다줄지 몰라 이러지도 저러지도 못한 채 주저한다. 고민 끝에 결정한 선택을 밀고 나아가는 과정에서도 우리는 끊임없이 방황하고 고민한다. 때론 주변의 시선과 타인과의 비교를 통해 자신의 선택을 후회한다. 왜 더 나은 선택을 하지 못했는지 자책한다.

그러나 책 『이러지도 저러지도 못하는 당신에게』는 말한다. 당신이 선택한 거라면, 당신이 그 선택을 믿는다면, 그 어떤 선택도 옳다고. 틀린 선택은 없다고. 타인의 시선으로 보면 무수히 많은 ‘틀린 선택’을 해왔지만, 자신의 시선에선 전혀 틀리지 않았던, 그저 자신만의 ‘선택’을 해왔던 저자의 생각과 고민, 경험을 통해 방황하는 독자들은 가볍지 않은 위로를 받을 것이다.
 ",10.0,1
달의 조각,에세이,"온 마음을 다하여 읽고 싶은 책, 『달의 조각』‘겨울 한정 스페셜 에디션’

지난해 많은 독자들에게 사랑을 받은 책,『달의 조각』이 ‘겨울 한정 스페셜 에디션’으로 출간되었다. 감성적이지만 단호한 작가의 글은 겨울과 제법 잘 어울린다. 독자들도 겨울을 떠올리게 하는 책이라고 말하기도 한다. 작가가 사랑하는 계절, 겨울의 느낌을 한껏 묻혀 다시 탄생했다. 독자에게 전하는 진심이 담긴 작가의 인사를 비롯하여 지난 책에 담지 못한 50페이지 정도의 원고가 ‘속삭이는 비밀’이라는 제목으로 추가되었다. 새 옷을 입은『달의 조각』은 불완전한 시기를 살아가는 우링에게 따뜻한 말 한마디를 건넬 것이다. ‘우리는 모두 미완성이라고, 불완전하지만 우리의 존재는 더 없이 소중하다고.’

밖의 공기에서 겨울 냄새가 느껴지면 어쩔 수 없이 조금 설레고 맙니다. 편애하는 계절이 다가오는 기척이기 때문이겠지요. 사람은 결국 태어난 계절을 가장 좋아하게 된다는 말은 사실일까요. 그 말의 기준이 되는 사람으로 오래 살아왔습니다. 겨울이었습니다. … 여전히 그 혹독한 계절을 사랑합니다. 가장 추운 날 가장 큰 힘이 되었던 서로의 온기 덕분입니다. 서툰 글에 마음을 내어 주신 당신께 그때 말하지 못한 몇 장의 비밀을 속삭입니다.
받은 온기에 대한 조그만 보답이 되었으면 좋겠습니다.” _스페셜 프롤로그 중에서
 ",9.7,1
단 하루도 너를 사랑하지 않은 날이 없다,에세이,"200만 SNS 독자의 연애세포를 깨운
‘사랑할 때 알아야 할 것들’ 김재식 작가의 두 번째 이야기
“우리는 또다시 사랑을 시작해야 한다.”

떠올리면 울어버릴 것 같은 사람이 있다. 그때는 몰랐던 마음을 이제야 깨닫고 그리움으로 벌 받고 있다. 하루도 잊어본 적 없는 너, 하루도 놓아본 적 없는 나… 우리는 사랑일까? 사랑 뒤에 오는 것들은 미숙했던 생각과 배려하지 못했던 마음이다. 온전히 나답게, 다시 뜨겁게 사랑하기 위해선 상처들을 조심스레 내려놓아야 한다고 조언하는 사람. 김재식 작가는 국내 최대 규모의 사랑 커뮤니티 ‘사알’을 운영하며, 베스트셀러『사랑할 때 알아야 할 것들』을 펴내 수많은 독자를 사로잡았다.

『단 하루도 너를』은 200만 팔로워가 3년을 기다린 작가의 신작이다. 누적 조회수 50억 뷰, 3억 개 이상의 공감을 얻은 글 중 큰 호응을 이끌어낸 글들을 엄선하고, 더욱 단단해진 작가의 감성을 담았다. 우리가 진정한 사랑을 만나기까지 겪게 되는 마음의 단계를 여덟 파트로 나누어 사랑을 둘러싼 복잡미묘한 감정을 들여다보고 그 의미를 찬찬히 일깨워준다. 사랑 앞에서 길을 잃은 당신에게, 지금이 사랑하기 가장 좋은 순간임을 모르는 우리에게, 있는 힘껏 사랑해야 하는 이유를 알려주고 성숙한 사랑법을 안내한다.

 ",9.1,0
종교 밖으로 나온 성경,에세이,"천지창조, 선악과 이야기, 노아의 방주, 바벨탑 사건, 십계명 등 12장으로 이루어져 있으며, 신구약의 주요 이야기를 통해 성경이 본래 전하려고 했던 바가 무엇인지를 깊이 있게 들여다보고 있다. 책 전반에 걸쳐 어디에서도 보지 못한 신선한 통찰들을 만날 수 있다.
 ",9.7,1
