book_name,book_category,book_intro,book_score,y
시와 산책,에세이,"“산책에서 돌아올 때마다 나는 전과 다른 사람이 된다.”
시가 산책이 될 때, 산책이 시가 될 때…

시를 읽는다는 건 무엇일까? 그럼, 산책을 한다는 건? 그건 어쩌면 고요한 하강과, 존재의 밑바닥에 고이는 그늘을 외면하지 않는 묵묵함의 다른 말일지도 모른다. 그건 결국 산다는 것은 무엇일까에 대한 질문일 수도 있고, 여기에 내가 살고 있다고 말하는 초록색 신호일 수도 있다.‘말들의 흐름’ 시리즈의 네 번째 책『시와 산책』은 작가 한정원이 시를 읽고, 산책을 하고, 과연 산다는 건 무엇일까에 대해 고민해온 시간들을 담아낸 맑고 단정한 산문집이다. 그리고 놀랍게도 작가의 첫 책이다. 놀라운 이유는 이 책이 너무나 좋아서.

작가가 쓴 스물일곱 개의 짧은 산문에는 그녀가 거쳐온 삶의 표정들이, ‘시’와 ‘산책’을 통해 느꼈던 생활의 빗금들이 캄캄한 침묵 속에서도 의연히 걸어가는 말줄임표처럼 놓여 있다. 한없이 느리게도 보이고, 더없이 끈질기게도 보이고, 지극히 무연하게도 보이는 문장들로 그녀는 ‘시’와 ‘산책’으로 쓸 수 있는 가장 아름다운 산문을 완성한다. 책장을 넘기자마자 우리는 그녀가 평생 시를 쓰고, 읽고, 보듬고, 도닥이면서도 결국 혼자 꽁꽁 얼려두고 숨겨만 두었던 마음속의 아주 깊은 곳으로 첨벙 뛰어들어, 그녀의 조용한 방관 아래에서 페소아와, 월러스 스티븐즈와, 로베르트 발저와, 파울 첼란과, 세사르 바예호와, 가브리엘라 미스트랄과, 울라브 하우게와, 에밀리 디킨슨과, 안나 마흐마토바와, 라이너 마리아 릴케와, 포루그 파로흐자드와, 실비아 플라스와, 가네코 미스즈를 만나고야 만다. 그녀와 함께, 그녀가 사랑했던 시인들과 함께, 그녀가 종종 입 밖으로 소리 내던 시어들과 함께, 천천히 너르게 산책을 떠난다. 우리는 그녀를 따라 겨울의 마음이 되었다가, 봄의 소리가 되었다가, 여름의 발자국이 되었다가, 가을의 고양이가 되고, 서로가 서로의 시가 되고, 서로가 서로의 산책이 되기도 한다. 우리는 서로를 쓰다듬으며 서로에게 묻기도 한다.

“당신은 당신이 낯설지 않나요? 당신이 잘 보이나요?” _본문 중에서

우리는 자신으로 살기 위해 누구처럼 살지 말자고 서로에게 다짐도 한다. 그녀의 문장으로 웅장해진 가슴이 신기하고 자랑스러워 제법 힘껏 펴기도 하고, 왠지 모르게 부끄러워져 감추기도 하면서도, 결국은 그녀의 문장들로 점점 거대하고 성대해지는 우리의 세계를 목격하는 기쁨을 누린다.
아주 멀리서 불어오는 바람처럼『시와 산책』의 문장들은 몇 번을 곱씹으며 기다리고 기다린 끝에야 우리에게 와 곁을 내어준다. 어느 날은 우리를 젊어지게도 하고, 어느 날은 우리를 늙어가게도 하면서. 그러니, 바로 지금이, 우리가 ‘시’와 ‘산책’을 할 바로 그 순간이다.


 ",9.7,1
모든 사람에게 좋은 사람일 필요는 없어,에세이,"타인이 아닌 ‘나’를 위한 인간관계 교과서!

인간관계 에세이의 열풍을 일으킨 바로 그 책!! 인간관계 때문에 상처받고 있는 현대인에게 가장 큰 위로가 되어줄 책이다. 30만 명의 독자들이 인정한 김유은 작가의 장편 인간관계 에세이집 『모든 사람에게 좋은 사람일 필요는 없어』에는 인간관계에 대한 다양한 이야기들과 그에 대한 해결책이 담겨있다.

우리는 걱정하는 척하며 뱉는 지나친 간섭과 충고라는 핑계로 쏟아내는 무례한 말에 상처받으며 살아간다. 친구와 사이좋게 지내라는 법만 배웠고, 진짜 친구의 의미에 대해서는 아무도 알려주지 않았다. 예의 바르고 착한 사람이 되라는 말만 들었고, 무례하고 못된 사람과 어떻게 지내야 하는지 배우지 못했다. 저자는 일상에서 겪을 수 있는 여러 가지의 인간관계에 대한 문제들을 직접 부딪혀보고, 다치고, 울기도 하면서 책 안에 고스란히 담아내었다. 무례한 사람과는 멀어질 수 있는 용기, 진짜 우정을 구별하는 방법, 사랑 안에서도 자신을 잃지 않는 해법을 말하고 있다.

수만 건의 무료 상담과 무료 강연을 진행한 저자 김유은은 독자들의 고민을 가까이에서 들어주고, 직접 풀어내면서 느낀 인간관계의 어려움을 극복하고 다시 일어서서 앞으로 나아가는 방법을 제시한다. 타인이 아니라 오직 ‘나’를 위해 살아갈 수 있도록 가슴 따뜻한 위로를 전해준다.
 ",8.1,0
먼길로 돌아갈까?,에세이,"MD 한마디
[게일 콜드웰, 캐럴라인 냅 우정의 연대기] 퓰리처상 수상작가 게일 콜드웰과 『명랑한 은둔자』 캐럴라인 냅 두 작가가 나눈 우정과 애도의 연대기. 캐럴라인 냅이 세상을 떠나자 게일은 함께 한 7년의 시간을 기억하며 그녀를 애도한다. 함께 걷고 이야기하고 기쁨과 슬픔, 위로를 주고받으며 자라난 둘의 우정이 오래도록 마음에 남는다. - 에세이 MD 김태희
퓰리처상 수상 작가 게일 콜드웰
『명랑한 은둔자』 『욕구들』의 작가 캐럴라인 냅
두 사람이 나눈 깊은 우정과 애도의 연대기

자신을 온전히 내보이고 이해받을 수 있는 상대를 만나는 것, 그와 순도 높은 우정을 나누는 경험은 삶에서 드물게 찾아오는 행운이다. 그런 존재를 죽음으로 잃고 혼자 남겨지는 상실감이란 어떤 것일까. 『먼길로 돌아갈까?』는 미국의 문학평론가이자 퓰리처상 수상 작가 게일 콜드웰이 『명랑한 은둔자』 『욕구들』의 작가 캐럴라인 냅을 만나 나눈 특별한 우정과, 그녀를 갑작스러운 죽음으로 떠나보낸 뒤 찾아온 애도의 시간을 그린 에세이다. “따로 있을 때는 겁에 질린 술꾼이자 야심찬 작가이며 애견인”이던 두 사람이 가족보다, 때로는 연인보다 가까운 관계를 맺고 특별한 마음을 나누었던 7년의 기억이, 예기치 못한 상실과 그 이후의 시간을 온몸으로 견뎌낸 기억이 담담하고도 섬세한 문장으로 펼쳐진다.

개와 인간이 교감하며 함께 살아가는 이야기이기도 한 이 책은 2010년 발표 당시 [뉴욕 타임스] 베스트셀러에 올랐고, [타임] 선정 ‘올해의 논픽션’, [워싱턴 포스트] [로스앤젤레스 타임스] [USA 투데이] [샌프란시스코 크로니클] [O: 오프라 매거진] [퍼블리셔스 위클리] 선정 ‘올해의 책’에 이름을 올렸다. 국내에는 2013년 처음 소개된 후 절판되었지만 아쉬움을 표하는 독자들의 목소리가 꾸준히 이어졌고, 문학동네에서 한국어판 저자 서문을 더하고 번역을 다듬어 새로운 만듦새로 다시 선보인다. “먼길로 돌아갈까?”는 두 사람의 일과였던 산책 도중 헤어지는 시간을 좀더 늦추고 싶어 캐럴라인이 습관처럼 건네던 말이다.

하루가 이대로 끝나지 않기를 바라는 날이면, 누군가 말하곤 했다. “집까지 먼길로 돌아갈까?” 차를 몰고 있든 걷고 있든 다르지 않았다. 여기에는 이런 뜻이 담겨 있었다. “좀 슬렁슬렁 가보자, 시간이 천천히 흐르도록, 지금이 조금 더 길어지도록.” 오래오래 계속 이어지도록. (5쪽)
 ",9.6,1
빨강머리 앤이 하는 말,에세이,"TV 스튜디오의 명작 애니메이션
[빨강머리 앤] 삽화 수록!

루시 모드 몽고메리의 고전 [그린 게이블의 앤]을 원작으로 1979년 일본 후지TV가 [명작극장]으로 제작했던 [빨강머리 앤]은 1980~1990년대 유년기를 보낸 한국독자들에게도 잊지 못할 추억을 남긴 작품이다. “주근깨 빼빼마른 빨강머리 앤, 예쁘지는 않지만 사랑스러워!”로 시작되는 주제가와 빨강머리 앤이 남긴 수많은 화제들을 기억하고 있다면 『빨강머리 앤이 하는 말』의 출간에 환호하지 않을 수 없을 것이다.

[스타일], [다이어트의 여왕], [아주 보통의 연애], [애인의 애인에게]까지, 신작을 발표할 때마다 많은 독자들에게 큰 호응을 받고 있는 작가 백영옥에게도 빨강머리 앤은 루시 모드 몽고메리의 소설 속 앤이 아니라 지브리 애니메이션 속의 ‘빨강머리 앤’이었다. 작은 기쁨부터 큰 슬픔까지, 소녀시절을 수놓는 마음들을 쉴 새 없이 나누었던 앤과의 추억, 그리고 인생의 가장 힘겨웠던 고비마다 뜻밖의 위안과 웃음과 눈물을 선물한 앤의 이야기들을 이제부터 어른으로의 삶을 헤쳐가야 할, 일과 연애와 꿈의 좌절에 끊임없이 맞닥뜨려야 할 날들을 다독이는 격려의 말로 되살려냈다. 어떤 어려움이 닥쳐도 터무니없을 만큼 희망에 차 있던 앤을, 그 시절 마음에 깊이 새겼던 앤의 모습들과 함께 추억하는 일은, 우리가 한 번뿐인 삶을 사는 동안 가장 소중한 때를 놓치지 않고, 어쩌면 바로 지금쯤 돌아보아야 할 따뜻한 이야기들을 모아보는 일이다.
 ",9.0,0
엉망으로 살자,에세이,"세상에서 가장 게으른 일러스트레이터, 노선경의 4년만의 신작!

지금까지 이런 저자는 없었다. 팬티요정이라 불리는 크리에이터 노선경! 페이스북과 인스타그램을 하다 보면 한 번씩 본 적 있는 그녀의 그림은 한 때 크게 주목받는 일러스트레이터이고 지금은 크리에이터로도 활발하게 활동하며 입지를 크게 다지고 있다. 첫 번째 책인 『훗날 내 청춘을 떠올리면 네가 가장 먼저 생각날 거야』가 사랑하는 사람과 나누는 행복한 일상이었다면 이번에는 180도 다른 『엉망으로 살자』라는 파격적인 책으로 돌아왔다.

제목만 보면 인생 막 살자는 뜻으로 오해할 수 있지만 그건 아니다. ""열심히 일한 만큼 열심히 놀자""라는 말은 순서가 잘못됐다. 행복하게 놀고 나서야 비로소 그 행복을 다시 얻기 위해 더 열심히 일할 수 있다고 말한다. 『엉망으로 살자』는 더 열심히 놀기 위해 세상과 타협하는 법을 배울 수 있다고 보면 된다.

저자 노선경은 대충 사는 듯 열심히 살았고, 좋아서 하는 일에 애매한 결과는 단 하나도 없었다. 어떤 분야의 최고가 되라는 것이 아닌 뭐든 좋으니 미쳐있으라 그녀는 말한다. 저자의 조언을 듣다보면 당신도 어쩌면 한 분야에 미쳐서 할 수 있는 일을 찾는 건 시간 문제이지 않을까 싶다.",7.0,0
이상하고 자유로운 할머니가 되고 싶어,에세이,"MD 한마디
그림책을 읽는 어른으로 살아가는 ‘무루’. 어제보다 오늘 조금 더 나은 삶을 완성하기 위해 그녀는 오늘도 그림책을 읽는다. 혼자서 천천히 세상을 바라보고, 모험과 성장을 두려워하지 않는 그림책 속에서 발견한 세상. 그 길을 따라가다 보면 우리의 세상도 몇 칸쯤 더 넓어질 것 같다. - 에세이 MD 김태희
“사는 것이 무엇을 향해 가는 일인지 조금씩 더 선명해졌으면 좋겠다”

비혼, 여성, 프리랜서, 집사, 채식지향주의자, 그림책 읽는 어른…
세계의 가장자리를 살아가는 마음가짐에 관하여

그는 ‘스스로를 완성해 나가는 개인’으로서 나중에는 틀림없이 멋진 할머니가 될 것 같다. 종종 오해받지만 무척 현명하여, ‘진실도 작게 말하는’ 할머니가. 나는 이 글들을 사랑한다.
-김하나 작가, 『여자 둘이 살고 있습니다』 저자

그림책을 한아름 안은 무루 작가는 우리에게 자신이 겪은 고통과 슬픔과 상처와 후회와 기쁨과 행복을 보여주고, 모험과 성장은 살아낸 사람만이 누릴 수 있는 진귀한 경험이라고 말한다.
-김영민 서울대 정치외교학부 교수, 『아침에는 죽음을 생각하는 것이 좋다』 저자

모두가 정상으로 여기는 삶에서 비껴 나 현실보다는 이상을 사는 듯한 조금 이상한 사람. 비혼 여성으로, 프리랜서로, 고양이의 집사로, 채식지향주의자로, 그림책 읽는 어른으로 살아가는 저자 무루가 자신의 삶과 그림책을 엮어 첫 에세이를 내놓았다. 그림책은 비교적 단순한 그림과 짧은 글이 만들어내는 작은 목소리로 삶 안팎에 크고 깊은 파장을 일으키곤 한다. ‘어른들을 위한 그림책 읽기’의 안내자이기도 한 그는 한 권의 그림책을 읽는 일을 “한 번도 열어보지 못한 방의 문을 열고 들어가는 것”에 빗댄다. 그때마다 우리의 “세계가 한 칸씩 넓어진다”고 말이다. 이 책은 세계의 언저리를 사는 존재가 ‘이상하고 자유로운’ 자신의 본성대로 살기 위해, ‘어제보다 오늘 조금 더 나은’ 삶을 완성해 나가기 위해, 그림책을 읽고 부단히 세계를 확장해온 어른의 성장 기록이기도 하다. 그의 지도를 따라 걷다 보면 어느새 우리의 세계도 한 칸, 어쩌면 여러 칸쯤 더 넓어진 것만 같다.
 ",9.4,0
죽고 싶지만 떡볶이는 먹고 싶어,에세이,"“자기가 지금 힘든 줄도 모르고 사는 사람이 많아요.
이유 없는 허전함에 시달리면서.”

“우리는 울지 않는 사람이 아니라
울고 싶을 때 울 수 있는 사람이어야 한다.”

가벼운 감기가 몸을 아프게 하듯, 가벼운 우울도 우리의 정신을 아프게 한다. 우리는 이제 말해야 한다. 별일 없이 사는데도 채워지지 않는 마음의 빈 공간에 대해서, 친구들과 웃고 떠드는 동안에도 울적한 마음 한구석에 대해서.

많은 이들이 멋지고 밝은 모습을 보여주는 것엔 익숙하지만, 찌질하고 어두운 모습은 감추려고 한다. 그러나 당신이 행복해지기 위해 알아야 할 한 가지는, 당신의 마음 한 켠의 우울을 못 본 척해서는 절대로 행복해질 수 없다는 사실이다.

이 책은 기분부전장애(가벼운 우울 증상이 지속되는 상태)를 가진 저자와 정신과 전문의와의 12주간의 대화를 엮은 책이다. 겉보기에는 멀쩡하지만 속은 곪아 있는, 지독히 우울하지도 행복하지도 않은 사람들을 위한 책이며, 타인의 시선으로부터 자유롭지 못하고, 불완전하고, 구질구질한 우리 모두의 이야기다. 이 한 권의 책이 당신의 슬픔을 모두 가져가주지는 못하겠지만, 적어도 울지 않는 사람이 아니라 울고 싶을 때 울 수 있는 사람이 되도록 도와줄 것이다.
 ",7.9,0
나는 내 딸이 이기적으로 살기 바란다,에세이,"“딸아 처음부터 너는 너였단다.
누구의 딸, 아내, 며느리, 엄마가 아닌 네 이름으로 살아가기를”

눈부신 세상을 살아갈 이 시대 모든 딸에게
엄마의 진심을 꾹꾹 눌러 담아 전하는 이야기

여자의 인생은 결혼 전과 결혼 후로 나뉜다는 말이 있다. 대부분 사람에게 결혼이란 삶을 살며 내린 수많은 결단 중 가장 행복한 선택의 순간, 당당한 선택의 순간이었을 것이다. 그런데 이상하게도 결혼 후에는 이전에는 느껴보지 못했던, 자꾸만 자신이 작아지고, 지워지는 것만 같은 상황을 만나게 된다. 때때로 외로이 떠 있는 섬이 된 것만 같은 기분이다. 나는 여전히 나인데, 왜 자꾸 이전보다 도태된 삶을 살고 있다고 느끼는 걸까. 이러한 물음에 누구 하나 속 시원히 이유를 말해주지 않는다.

이 책 『나는 내 딸이 이기적으로 살기 바란다』는 그동안 아무도 제대로 답해주지 않았던 그 대답을 용기 있게 전하고자 한다. 저자는 아들을 못 낳으면 죄인이었던 시대, ‘딸 같은 며느리’를 얻었다며 좋아하던 시부모의 말에 연신 고개를 주억거리던 친정부모의 모습이 너무나 자연스러워서 반발하지 못했던 삶을 살아온 세대다. 그런데 딸의 결혼을 앞두고는 더 이상 가만히 있을 수 없었다. 그래서 오랜 세월 꾹꾹 눌러 담았던 모든 말들을, 딸에게 꼭 전해야 하는 당부의 말들을 엄마인 자신의 이야기를 빌어 담담히 풀어내기로 마음먹었다. 앞으로 눈부신 삶을 살아갈 사랑하는 딸에게 엄마로서, 한 시대를 먼저 살아낸 여성으로서 ‘누구의 딸, 아내, 며느리, 엄마가 아닌 온전한 나로 살아가기’라는 애정 어린 당부를 정성스레 전하고자 결심했다. 그리고 엄마의 지나온 삶이 이 시대 딸들의 삶에 그림자가 되지 않기를 바라는 마음으로, 뜨거운 응원과 지지를 이 글에 담아냈다.

이 책은 기혼 여성을 넘어 이 시대를 살아가는 여성이라면 마주할 이야기, 모든 여성의 이야기다. 부디 이 책이 세상 모든 딸들의 마음을 위로하고 다시 한 번 자신을 사랑할 수 있는 용기를, 시작할 수 있는 용기를 주기를 간절히 기대해본다.
 ",9.8,1
당신을 응원하는 누군가,에세이,"힐링은 거창한 것이 아니다. 오늘을 살아가는 우리들에게 힐링은 어쩌면 잠시 쉬었다 갈 수 있는 쉼의 공간, 인생의 쉼표인 것이다. 여기 [당신을 응원하는 누군가]는 우리들에게 글과 그림으로 작지만 따뜻한 쉼의 공간 제공하고 있다.
 ",9.0,0
이왕이면 행복해야지,에세이,"“누군가를 걱정하기 시작했다는 건
말려들기 시작했다는 것”

사람 하나 개 하나 고양이 둘
어쩌다 가족이 된 우당탕탕 도대체 씨네 이야기

좋아하는 일을 통해 삶을 풍요롭게 가꾸는 애호 생활 에세이 브랜드 ‘라이킷(Lik-it)’의 열 번째 책 『이왕이면 행복해야지』가 출간되었다. 위기의 순간, 촛불처럼 환한 웃음 요소를 탁월하게 포착해내는 ‘도대체’ 작가의 따뜻한 그림 에세이이다. 길고양이 ‘꼬맹이’와 ‘장군이’와의 소박했던 첫 만남부터 가족으로 맞이하고 사랑의 무게를 실감하기까지의 짧지 않은 여정이 유쾌하게 담겼다. 희망 없는 세상에 나를 좋은 사람이라 기억할 작은 존재들을 위한 깊은 마음을 그렸다.
 ",9.8,1
스스로 행복하라 (10만 부 기념 에디션),에세이,"「무소유」, 「텅 빈 충만」 등
우리의 지치고 흐트러진 마음을 다잡아 주는
법정 스님의 대표 수필 모음집

『스스로 행복하라』 10만 부 기념 양장 에디션!

『스스로 행복하라』가 10만 부 출간을 기념하여 새로운 표지로 갈아입고 양장본으로 출간된다. 코로나19 펜데믹이라는 전혀 예상치 못한 세상을 살아가며 불안감과 우울감에 시달리는 우리는 행복으로부터 점점 멀어지고 있는 듯한 생각에 빠지기 쉽다. 코로나19 시대가 본격적으로 시작된 2020년 초, 법정 스님 열반 10주기에 맞춰 출간된 『스스로 행복하라』는 우리의 지치고 흐트러진 마음을 다잡아 주며 고난을 극복할 용기를 주었다. 이 책은 출간 즉시 베스트셀러에 올랐으며 주요 서점 및 독자 선정 올해의 책으로 꼽히는 등 많은 사랑을 받았다.

『스스로 행복하라』는 법정 스님이 남긴 글들 중 인생을 행복하게 살아가는 데 도움이 되는 글을 가려 뽑아 한 권의 책으로 묶은 것이다. 1장 ‘행복’에는 인생의 가치를 어디에 두어야 할지에 대한 법정 스님의 가르침을 담았고, 2장 ‘자연’에는 자연과 함께하는 충만한 삶을 설파하는 글들을 담았다. 3장 ‘책’에는 법정 스님이 『어린 왕자』, 『모모』, 『희랍인 조르바』 등 책에서 발견한 지혜를 전하며, 4장 ‘나눔’에는 “사랑한다는 것은 곧 주는 일이요, 나누는 일이다. 주면 줄수록, 나누면 나눌수록 넉넉하고 풍성해지는 마음이다”라는 나눔의 메시지가 담겨 있다.

고된 일상 속에 갇혀 허우적거리는 우리에게 법정 스님은 이런 질문을 던진다. “우리는 가진 것만큼 행복한가?” 몸소 무소유의 삶을 실천하며 삶의 진리와 철학이 담긴 글로 우리에게 깊은 울림을 줬던 법정 스님. 집착에 사로잡혀 어떻게 살아야 할지 갈피를 못 잡고 있는 우리는 법정 스님이 남긴 글을 통해 인간다운 삶, 가치 있는 삶을 위한 지혜를 얻을 수 있다. 법정 스님의 맑고 향기로운 지혜가 담긴 『스스로 행복하라』를 곁에 두고 오래 읽을 수 있도록 양장본으로 선보인다.
 ",9.8,1
"안녕한, 가",에세이,"이따금 허해지는 마음을 채워준 집의 위로
- 도시생활자 무과수의 일상 기록

집 안 혹은 집 밖의 풍경을 기록하고 일상에 영감을 주는 콘텐츠로 대중에게 ‘집의 위로’를 선사하는 에디터 무과수의 에세이. 의미 있다고 생각하는 생활의 면면을 포착해 만든 『안녕한, 가』는 사계절 플레이리스트처럼 여름, 가을, 겨울, 봄의 순서로 구성되어 있다. 소박하지만 단단한 생활력이 느껴지는 글과 사진을 통해 삶이 버겁다고 느끼는 이들에게 뜻밖의 위안을 전한다. 이상과 일상을 분리하지 않고 매순간을 소중하게 생각하며, 성실하게 쌓아 올린 ‘하루’의 힘을 믿는 그의 기록은 도시 생활자를 위한 진정한 ‘일상의 기술’이다.
 ",8.3,0
신령님이 보고 계셔,에세이,"귀신 들린 여자, 사이비 종교, 사기꾼?
세상의 오해 앞에 ‘요즘’ 무당 홍칼리가 펼치는 놀랍도록 솔직하고 정성껏 다정한 무지개색 굿판!

지구 반대편의 소식을 클릭 한 번으로 알 수 있고 내일 날씨를 손안에서 확인할 수 있는 시대지만 신년이 되면 점집은 여전히 붐빈다. 그러나 무엇이든 알 것만 같은 ‘무당’에 대해서는 정작 알려진 바가 많지 않다. 무당도 연애를 할까? 무당에게는 내 마음속 비밀도 훤히 보이는 게 아닐까? 전업 무당이자『신령님이 보고 계셔』의 저자 홍칼리는 세상의 온갖 오해와 호기심 앞에, 드디어 자신의 색다른 일상을 직접 꺼내놓기로 했다. 한 번도 본 적 없는 ‘요즘’ 무당 홍칼리의 『신령님이 보고 계셔』는 세상이 오해해온 ‘무당’이라는 직업을 새롭게 바라볼 계기를 제공할 것이며, 믿는 이들은 물론, 믿지 않는 이들에게도 자신을 돌보고 사랑할 용기를 줄 것이다.
 ",9.3,0
살고 싶다는 농담,에세이,"MD 한마디
죽음과의 사투 끝에 삶으로 돌아온 작가 허지웅의 신작 에세이. 깊은 절망에서 나와 아직 우리가 살아야 할 이유를 이야기 한다. 불행을 안고 살아가는 삶이 얼마나 안타까운 삶인지, 투병 이후 인생에 대해 확연히 달라진 그의 생각을 담았다. 오늘도 절망과 싸우는 모든 이들에게 바치는 위로. - 에세이 MD 김태희
오늘도 절망과 싸우는 모든 이들에게 전하는,
그럼에도 불구하고 살아야 하는 이유

작가 허지웅이 2018년 혈액암의 일종인 악성림프종이라는 큰 시련을 겪은 뒤, 인생에 대해 이전과는 확연히 달라진 시각을 가지고 혼신의 힘을 기울여 쓴 신작 에세이다. 저마다 자신만의 무거운 천장을 어깨에 이고 무너지지 않으려 애쓰는 사람들, 기대어 쉴 곳 없이 지쳐 있는 사람들에게 들려주고 싶은 25편의 이야기들을 담았다. 전작 『나의 친애하는 적』 이후 4년 만에 발표하는 이번 신작에서 작가 허지웅의 삶의 해석은 더 예리해지고, 사람을 향한 애정은 더 깊어졌다.

고통과 불행으로부터 벗어나기 위해 발버둥쳐보지 않은 사람이 있을까. 그러나 불행을 탓하는 일에만 몰두하다 보면 자칫 더 큰 피해의식의 수렁에 빠지고 만다. 불행한 현실 탓에 나만 이렇게 억울한 상황에 놓였고, 불행하기 때문에 여기서 벗어날 수도 없다는 절망감의 악순환이다. 이에 대하여 저자는 “불행이란 설국열차 머리칸의 악당들이 아니라 열차 밖에 늘 내리고 있는 눈과 같은 것”이라고 말하며, 껴안고 공생하며 함께 인생을 버텨나가야 하는 감정으로서 불행을 인정하고 자신의 삶을 주체적으로 바라보자고 제안한다. 이 책은 죽음과의 사투 끝에 삶으로 돌아온 작가 허지웅이 힘겨운 현실에 시름하는 사람들에게 들려주는 단단한 조언이자 결국 오늘도 버티는 삶을 살아내고 있는 모든 이들에게 바치는 따뜻한 위로다.

 ",9.6,1
